433,These deals make for good last-minute Valentine’s Day gifts,https://www.theverge.com/good-deals/2020/2/13/21136095/beats-studio-3-wireless-noise-canceling-headphones-ring-doorbell-valentines-gifts
434,Microsoft and Nike have created a custom Jordan-branded Xbox One X,https://www.theverge.com/2020/2/13/21136138/microsoft-nike-xbox-one-jordan-custom-console-sneakers-marketing
435,"SEC wraps investigation into Model 3 production numbers, Tesla says",https://www.theverge.com/2020/2/13/21136080/tesla-sec-investigation-closed-model-3-production-subpoena
436,From The Strategist: the best roller skates,https://www.theverge.com/2020/2/13/21127956/best-roller-skates-recommendation-beginner-rink-street-strategist
437,Motorola Razr review: folding flip phone flops,https://www.theverge.com/2020/2/13/21135809/motorola-razr-review-foldable-flip-phone-verizon-price-camera-display-battery
438,Facebook Dating misses European launch for Valentine’s Day over regulatory dispute,https://www.theverge.com/2020/2/13/21136012/facebook-dating-european-launch-delayed-data-protection-gdpr
439,Microsoft sneaks working Surface Duo demo into failed event recording,https://www.theverge.com/2020/2/13/21135958/microsoft-surface-duo-demo-microsoft-365-dev-days-event-recording-filming-demo-fail
440,Robo Revenge helps you get paid to take down robocallers,https://www.theverge.com/2020/2/13/21135940/donotpay-sue-robocallers-do-not-call-registry-telephone-consumer-protection-act
441,Xiaomi’s Mi 10 flagship 5G phones launch in China,https://www.theverge.com/2020/2/13/21135980/xiaomi-mi-10-specs-date-price
442,The biggest threat to MWC is tech companies realizing they don’t need it,https://www.theverge.com/tech/2020/2/13/21135777/mobile-world-congress-cancellation-whats-next
443,Motorola Razr undergoes iFixit’s ‘most complicated’ teardown yet,https://www.theverge.com/2020/2/13/21135977/motorola-razr-ifixit-teardown-hinge-mechanism-repairability-reliability
444,Kirsten Gillibrand outlines new Data Protection Agency to take on Big Tech,https://www.theverge.com/2020/2/13/21135231/kirsten-gillibrand-facebook-google-data-protection-agency-privacy-big-tech
445,These engineers are trying to rescue a ‘Bookbot’ from the Google graveyard,https://www.theverge.com/2020/2/12/21135334/google-bookbot-mountain-view-area120
446,DoorDash drivers use their forced arbitration clause to force DoorDash into arbitration,https://www.theverge.com/2020/2/12/21135474/doordash-workers-forced-arbitration-william-alsup
447,Apple’s free learn-to-code Swift Playgrounds sandbox arrives on Mac,https://www.theverge.com/2020/2/12/21135573/apple-swift-playgrounds-coding-app-available-mac
448,Snapchat is testing a big new redesign,https://www.theverge.com/interface/2020/2/12/21134892/snap-redesign-maps-community-discover-originals-shows-happening-now-news-briefs
449,Jeff Bezos bought the most expensive property in LA with an eighth of a percent of his net worth,https://www.theverge.com/2020/2/12/21135400/jeff-bezos-warner-estate-expensive-property-david-geffen-amazon
450,"Epic Games CEO Tim Sweeney thinks games can be political, but gaming companies should stay out of politics",https://www.theverge.com/2020/2/12/21135168/epic-games-ceo-tim-sweeney-dice-summit-gaming-companies-politics-privacy
451,Mark Zuckerberg’s privilege to be forgotten,https://www.theverge.com/2020/2/12/21135314/mark-zuckerberg-deleted-journals
452,Space startup’s founders linked to shady dating website ring,https://www.theverge.com/2020/2/12/21134844/firefly-aerospace-founders-max-polyakov-ceo-dating-site-sham
453,"The FTC is cracking down on influencer marketing on YouTube, Instagram, and TikTok",https://www.theverge.com/2020/2/12/21135183/ftc-influencer-ad-sponsored-tiktok-youtube-instagram-review
454,.com prices could rise for the first time in eight years,https://www.theverge.com/2020/2/12/21134632/domain-name-com-dot-price-increases-icann
455,"As Lambda students speak out, the school’s debt-swapping partnership disappears from the internet",https://www.theverge.com/2020/2/12/21135134/lambda-school-students-edly-isa-debt-swapping-partnership-shares-investors
456,"One of Mark Zuckerberg’s notebooks detailed ‘dark profiles,’ which would let people make Facebook profiles for their friends",https://www.theverge.com/2020/2/12/21134868/mark-zuckerberg-facebook-notebook-news-feed-dark-profiles-wired
457,Facebook caught Iranian trolls spreading pro-Trump propaganda online,https://www.theverge.com/2020/2/12/21134957/facebook-fake-trump-iran-russia-elections-foreign-interference
458,How to use Safari’s tools to protect your privacy while browsing,https://www.theverge.com/2020/2/12/21124844/apple-mac-safari-privacy-tools-private-network-browser-settings
459,The Essential Phone’s amazing track record of software updates is over,https://www.theverge.com/2020/2/12/21134995/essential-phone-software-updates-security-android-startup
460,The world’s biggest phone show has been canceled due to coronavirus concerns,https://www.theverge.com/2020/2/12/21127754/mwc-2020-canceled-coronavirus-trade-show-phone-mobile-world-congress-gsma-statement
461,"Essential, Andy Rubin’s phone company, is shutting down",https://www.theverge.com/2020/2/12/21134985/essential-phone-shutting-down-andy-rubin-startup
462,Microsoft’s xCloud game streaming arrives on iOS with some Apple restrictions,https://www.theverge.com/2020/2/12/21134952/microsoft-xcloud-game-streaming-ios-beta
463,"Census searches on Twitter will direct users to official links, but probably won’t stop any hoaxes",https://www.theverge.com/2020/2/12/21134578/census-searches-twitter-trump-pelosi-hoax-deepfakes
464,Spotify now lets you search by songwriter with clickable credits,https://www.theverge.com/2020/2/12/21134557/spotify-search-songwriter-pages-clickable-credits
465,Dell’s XPS 13 with a 10th Gen Intel Core i5 processor is $400 off,https://www.theverge.com/good-deals/2020/2/12/21134651/dell-xps-13-10th-gen-intel-core-i5-deal-sale-presidents-day
466,WhatsApp now has 2 billion users,https://www.theverge.com/2020/2/12/21134652/whatsapp-2-billion-monthly-active-users-encryption-facebook
467,Netflix offers a free movie to try to get people to subscribe for the sequel,https://www.theverge.com/2020/2/12/21134580/netflix-to-all-the-boys-ive-loved-before-release-stream-subscriber
468,"Tweeten, the best Windows Twitter app, is now available on Surface Pro X",https://www.theverge.com/2020/2/12/21134559/tweeten-windows-app-arm64-surface-pro-x-features-download-update
469,"YouTube continues to mirror Twitch, tests new clap feature that lets fans donate to creators",https://www.theverge.com/2020/2/12/21134512/youtube-viewer-applause-clapping-feature-monetization-creators-twitch-donations
470,The court let T-Mobile buy Sprint because Sprint completely sucks,https://www.theverge.com/2020/2/12/21134278/sprint-tmobile-merger-court-ruling-opinion-decision-explainer-carriers-antitrust
471,Samsung’s Galaxy Z Flip beats the Motorola Razr in nearly every way,https://www.theverge.com/2020/2/12/21134261/samsung-galaxy-z-flip-vs-motorola-razr-folding-flip-phone-camera-battery-processor
472,Samsung learned some tough lessons from the Galaxy Fold debacle,https://www.theverge.com/2020/2/12/21134380/samsung-galaxy-z-flip-fold-foldable-success-lessons-changes-report
473,Google brings emoji mashup stickers to Gboard on Android,https://www.theverge.com/2020/2/12/21132971/google-emoji-mashups-kitchen-gboard-android-cowboy-monkey-ghost-combination
474,Shooting 8K videos on the Galaxy S20 requires 600MB per minute,https://www.theverge.com/2020/2/12/21134451/samsung-galaxy-s20-8k-footage-recording-600mb-minute-storage-capacity
475,Why Samsung’s 108-megapixel camera isn’t just a gimmick,https://www.theverge.com/2020/2/12/21134366/samsung-108-megapixel-sensor-size-image-quality-noise-vs-iphone-xiaomi
476,"The Galaxy Z Flip is neat, but the Galaxy S20 is important",https://www.theverge.com/2020/2/12/21134164/samsung-galaxy-z-flip-galaxy-s20-keynote-recap
477,"YouTube, Twitter, and Facebook put on notice as UK names new internet regulator",https://www.theverge.com/2020/2/12/21134390/uk-internet-regulation-duty-of-care-ofcom-illegal-harmful-content
478,Amazon’s PR campaigns keep blowing up in the company’s face,https://www.theverge.com/interface/2020/2/12/21133393/amazon-jay-carney-op-ed-bernie-sanders-jobs-working-conditions
479,Microsoft and Samsung partner on Xbox cloud-based game streaming,https://www.theverge.com/2020/2/12/21134167/microsoft-samsung-xbox-partnership-xcloud-cloud-game-streaming
480,Galaxy Home Mini emerges as an S20 preorder bonus in South Korea,https://www.theverge.com/2020/2/12/21134367/samsung-galaxy-home-mini-pre-order-bonus-south-korea
481,This Sony remote control for TVs is also a portable speaker,https://www.theverge.com/2020/2/12/21134369/sony-remote-control-speaker-combo-price-date
482,Olympus’ OM-D E-M1 Mark III wants to make it easier to aim for the stars,https://www.theverge.com/2020/2/12/21083559/olympus-omd-em1-mark-3-starry-sky-af-mode-mirrorless-micro-four-thirds-camera
483,"Nikon’s D6 pro camera is coming in April for $6,500",https://www.theverge.com/2020/2/12/21134272/nikon-d6-specs-price-release-date-announced
484,Andrew Yang has withdrawn from the 2020 presidential race,https://www.theverge.com/2020/2/11/21134021/andrew-yang-drops-out-2020-presidential-race-democratic
485,"At $1,600, the highest-end Galaxy S20 costs as much as a foldable phone",https://www.theverge.com/2020/2/11/21133666/samsung-galaxy-flip-motorola-apple-iphone-razr
486,"The Galaxy Z Flip’s split-screen mode isn’t just for Samsung foldables, says Google",https://www.theverge.com/2020/2/11/21133907/samsung-galaxy-z-flip-google-split-screen-flex-mode-other-foldables
487,Flipboard will soon share short videos alongside the news for $3 a month,https://www.theverge.com/2020/2/11/21133774/flipboard-tv-subscription-service-short-form-video-samsung-galaxy-s20
488,"Nvidia’s GeForce Now is losing all Activision Blizzard games, a bad sign for cloud gaming",https://www.theverge.com/2020/2/11/21133793/nvidia-geforce-now-no-more-activision-blizzard-games-carriage
489,Samsung confirms its AirDrop-like ‘Quick Share’ is launching on the Galaxy S20,https://www.theverge.com/2020/2/11/21133825/samsung-galaxy-s20-quick-share-airdrop-easy-sharing-feature
490,Snapchat’s new mental health tool will offer helpful intervention,https://www.theverge.com/2020/2/11/21133568/snapchat-mental-health-snap-pinterest-instagram-teens
491,Samsung’s Galaxy S20 phones are getting Google’s helpful Live Caption feature,https://www.theverge.com/2020/2/11/21133758/samsung-galaxy-s20-google-live-caption-feature-duo
492,A first look at Microsoft’s new Windows 10X operating system for dual screens,https://www.theverge.com/2020/2/11/21132826/microsoft-windows-10x-features-dual-screen-foldable-hands-on-developers
493,Feds claim Huawei can snoop on mobile networks,https://www.theverge.com/2020/2/11/21133631/huawei-china-spying-claims-us-officials-blacklist-5g
494,YouTube could compete with Apple and Amazon by offering third-party video subscription services,https://www.theverge.com/2020/2/11/21133131/youtube-video-subscriptions-apple-amazon-premium-subscribers-google
495,We still can’t agree how to regulate self-driving cars,https://www.theverge.com/2020/2/11/21133389/house-energy-commerce-self-driving-car-hearing-bill-2020
496,Hyundai will build electric vehicles with EV startup Canoo,https://www.theverge.com/2020/2/11/21133461/hyundai-canoo-electric-cars-partership-kia
497,How to preorder the Samsung Galaxy Z Flip,https://www.theverge.com/2020/2/11/21124098/samsung-galaxy-z-flip-buy-pre-order-foldable-phone-price-date
498,Alphabet has moved technology incubator Jigsaw under Google management,https://www.theverge.com/2020/2/11/21133398/google-jigsaw-waymo-nest-brin-page-alphabet
499,Samsung Galaxy Z Flip first look: folding glass changes everything,https://www.theverge.com/2020/2/11/21132345/samsung-galaxy-z-flip-foldable-phone-photos-videos-specs-price-hands-on
500,"Here’s how Samsung’s Galaxy S20 stacks up against the Pixel 4, OnePlus 7T, and more",https://www.theverge.com/2020/2/11/21128464/samsung-galaxy-s20-comparison-google-pixel-4-oneplus-7t-note-10-s10-lg-g8x
501,How Samsung’s Galaxy S20 compares with the iPhone 11,https://www.theverge.com/2020/2/11/21129013/samsung-galaxy-s20-iphone-11-comparison-specs-features-price
502,All of the biggest announcements from Samsung’s Galaxy S20 event,https://www.theverge.com/2020/2/11/21125212/samsung-galaxy-s20-event-news-announcements-top-biggest-products-unpacked
503,The latest Marvel card game was designed specifically to blow up on Kickstarter,https://www.theverge.com/2020/2/11/21133282/marvel-united-kickstarter-board-game-price-release-date
504,Samsung’s Galaxy Z Flip should be more durable than the troubled Galaxy Fold,https://www.theverge.com/2020/2/11/21131622/samsung-galaxy-z-flip-foldable-phone-break-screen-unpacked-event-2020
505,Samsung’s Galaxy Z Flip has the first folding glass display,https://www.theverge.com/2020/2/11/21128085/samsung-galaxy-z-flip-folding-glass-display-foldable-phone-unpacked-event
506,"Samsung’s new foldable Galaxy Z Flip will arrive on February 14th for $1,380",https://www.theverge.com/2020/2/11/21126318/samsung-galaxy-z-flip-foldable-phone-release-date-price-features
507,The new Galaxy S20 phones are Samsung’s first to record 8K video,https://www.theverge.com/2020/2/11/21122379/samsungs-galaxy-s20-plus-ultra-8k-video-recording-quality-unpacked-2020
508,"Samsung’s Galaxy S10E, S10, and S10 Plus are $150 off",https://www.theverge.com/good-deals/2020/2/11/21127858/samsung-galaxy-s10-s10e-plus-price-buy-cheaper-phones-lineup
509,Samsung announces Galaxy Buds Plus earbuds with huge boost to battery life,https://www.theverge.com/2020/2/11/21128525/samsung-galaxy-buds-plus-earbuds-specs-price-release-date-bluetooth-unpacked
510,How Samsung’s Galaxy S20 Ultra achieves its 100x zoom,https://www.theverge.com/2020/2/11/21132870/samsung-galaxy-s20-ultra-zoom-100x-space-optical-hybrid-digital-periscope
511,Samsung’s regular Galaxy S20 doesn’t support ultra-fast 5G,https://www.theverge.com/2020/2/11/21133237/samsung-galaxy-s20-5g-ultra-fast-not-supported-carriers-coverage
512,"Samsung’s Galaxy S20, Plus, and Ultra first look: cameras, 5G, and 120Hz screens",https://www.theverge.com/2020/2/11/21128230/samsung-galaxy-s20-plus-ultra-price-camera-5g-features-video-hands-on
513,Google will provide political campaigns free access to Titan security keys for better 2FA,https://www.theverge.com/2020/2/11/21133110/google-campaign-security-2020-elections-defending-digital-campaigns
514,Microsoft backtracks on plans to force Chrome default search to Bing,https://www.theverge.com/2020/2/11/21133372/microsoft-search-chrome-extension-bing-default-search-plans-canceled
515,Google’s Nest will force customers to use two-factor authentication,https://www.theverge.com/2020/2/11/21133264/google-nest-2fa-force-two-factor-authentication
516,Live from Samsung’s Galaxy S20 and Z Flip keynote,https://www.theverge.com/2020/2/11/21083967/samsung-galaxy-s20-z-flip-keynote-live-blog-unpacked-event
517,Jaguar will pause I-Pace production because of battery shortage,https://www.theverge.com/2020/2/11/21133010/jaguar-ipace-production-halt-lg-chem-batteries
518,Microsoft promises Windows 10X updates will take ‘less than 90 seconds’,https://www.theverge.com/2020/2/11/21133272/microsoft-windows-10x-windows-updates-fast-speed-details
519,"Amazon, Google, and Facebook ordered to turn over evidence for far-reaching FTC merger review",https://www.theverge.com/policy/2020/2/11/21133268/facebook-microsoft-apple-amazon-google-antitrust-review-joe-simons
520,"Optimum raises prices on internet and TV plans, barely warning customers",https://www.theverge.com/2020/2/11/21131538/optimum-tv-internet-price-hikes-altice-warning-bill
521,Drake signs a ‘multiyear partnership’ with live-streaming platform Caffeine,https://www.theverge.com/2020/2/11/21131381/drake-partnership-caffeine-ultimate-rap-league-streaming
522,The latest USB-C chargers are apparently more powerful than Apollo 11’s computer,https://www.theverge.com/tldr/2020/2/11/21133119/usb-c-anker-charger-apollo-11-moon-landing-guidance-computer-more-powerful
523,Microsoft’s new Windows 10X emulator lets anyone play around with the dual-screen OS,https://www.theverge.com/2020/2/11/21132822/microsoft-windows-10x-emulator-dual-screen-os-testing-apps-compatibility-features
524,Apple restores mail app after developer tries to rally ‘Sherlocked’ victims,https://www.theverge.com/2020/2/11/21133023/apple-bluemail-blix-restored-mac-app-store-sherlocking-patent-lawsuit
525,Google’s gallery of wallpaper-perfect satellite photos just got a lot bigger,https://www.theverge.com/2020/2/11/21132964/google-earth-view-images-1000-new-images
526,Leak reveals Samsung’s new foldable Galaxy Z Flip has ‘flexible glass’,https://www.theverge.com/2020/2/11/21133156/samsung-galaxy-z-flip-flexible-glass-display-leak-cover-display-notifications-features
527,Patreon is adding new features for creators in Europe,https://www.theverge.com/2020/2/11/21131297/patreon-international-expansion-berlin-office-currencies-pound-euro
528,How to use Chrome’s tools to protect your privacy while browsing,https://www.theverge.com/2020/2/11/21126427/google-chrome-privacy-tools-private-network-browser-settings
529,Lightroom now supports split-screen multitasking on the iPad,https://www.theverge.com/2020/2/11/21132637/lightroom-split-view-multitasking-ipad-update-ipados
530,T-Mobile and Sprint win lawsuit and will be allowed to merge,https://www.theverge.com/2020/2/11/21132924/tmobile-sprint-merger-approved-federal-court-antitrust-lawsuit
531,New Jersey’s former attorney general on Ring cameras and facial recognition,https://www.theverge.com/2020/2/11/21120372/anne-milgram-ring-cameras-facial-recognition-policing-vergecast-podcast
532,Watch Samsung Galaxy Unpacked 2020 live,https://www.theverge.com/2020/2/11/21121001/samsung-galaxy-s20-event-watch-live-stream-z-flip-unpacked-2020
533,"Amazon’s Ring now lets you snitch on your neighbor’s good deeds, too",https://www.theverge.com/2020/2/11/21128727/amazon-ring-neighbors-app-neighborly-moments
534,Samsung’s Galaxy Z Flip phone needs to do way better than past foldables,https://www.theverge.com/2020/2/11/21128117/samsung-z-flip-phone-galaxy-fold-foldable-unpacked-event-2020
535,Why platforms aren’t taking down deceptive political videos,https://www.theverge.com/interface/2020/2/11/21131675/pelosi-video-hoax-facebook-twitter
536,Intel and Vivo join Sony and Amazon withdrawals from Mobile World Congress due to coronavirus risk,https://www.theverge.com/2020/2/10/21131118/mwc-2020-coronavirus-intel-sony-amazon-cancel
537,Amazon’s PR chief gets combative on Twitter over media criticism,https://www.theverge.com/2020/2/10/21132573/amazon-pr-chief-jay-carney-bernie-sanders-minimum-wage-media-criticism-twitter
538,Google’s head of HR is leaving while worker unrest continues,https://www.theverge.com/2020/2/10/21132366/google-eileen-naughton-culture-hr-people-operations-step-down
539,T-Mobile and Sprint’s industry-changing merger will reportedly clear its final hurdle tomorrow,https://www.theverge.com/2020/2/10/21132338/t-mobile-sprint-merger-lawsuit-new-york-times-wall-street-journal
540,Google Chrome will block insecure downloads in coming months,https://www.theverge.com/2020/2/10/21132099/google-chrome-users-block-insecure-downloads-https-android-ios
541,"IBM picks Slack over Microsoft Teams for its 350,000 employees",https://www.theverge.com/2020/2/10/21132060/ibm-slack-chat-employee-rollout-microsoft-teams-competition
542,US senators condemn Amazon’s ‘dismal’ safety records,https://www.theverge.com/2020/2/10/21132020/us-senators-amazon-jeff-bezos-dismal-safety-reform-records-warren-sanders-harris
543,Amazon is still crushing Google and Apple in the smart speaker market,https://www.theverge.com/2020/2/10/21131988/amazon-alexa-echo-google-apple-smart-home-speaker
544,These modded scanners let you play techno using barcodes,https://www.theverge.com/2020/2/10/21131532/ei-wada-japanese-artist-techno-modded-barcode-scanners-electronicos-fantasticos
545,Sprint’s first smartwatch for kids comes with location tracking,https://www.theverge.com/2020/2/10/21131668/sprint-smartwatch-watchmego-verizon-tmobile-kids-price-location-tracking
546,Apple’s epic patent troll fight drags on as appeals court strikes down latest request,https://www.theverge.com/2020/2/10/21131945/apple-virnetx-patent-case-us-appeals-court-lawsuit-legal
547,Nio’s struggles continue as coronavirus outbreak drags down sales,https://www.theverge.com/2020/2/10/21131326/nio-sales-china-coronavirus-electric-suv-es8-es6
548,"Samsung Unpacked 2020 event: all of the latest rumors, news, and more",https://www.theverge.com/2020/2/10/21128268/samsung-galaxy-s20-event-2020-news-announcements-rumors-unpacked
549,Nikola teases an electric pickup with 600 miles of range,https://www.theverge.com/2020/2/10/21131754/nikola-badger-hydrogen-electric-pickup-truck-specs-photos-battery-range
550,"Xiaomi shows off Mi 10 phone design, confirms February 13th launch date",https://www.theverge.com/2020/2/10/21131641/xiaomi-mi-10-design-launch-date-mobile-world-congress
551,Fiat Chrysler plans to launch a robot taxi service in China,https://www.theverge.com/2020/2/10/21131588/fiat-chrysler-autox-self-driving-taxi-china
552,Microsoft’s Surface Go is more affordable than ever today,https://www.theverge.com/good-deals/2020/2/10/21131405/microsoft-surface-go-type-cover-sale-deal-jabra-elite-65t-google-pixel-4
553,"Equifax was hacked by Chinese military officers, federal prosecutors say",https://www.theverge.com/2020/2/10/21131362/doj-justice-barr-china-equifax-breach
554,Abode adds HomeKit support to a second home security system,https://www.theverge.com/2020/2/10/21128714/abode-homekit-apple-home-security
555,Motorola confirms a gold-colored Razr is coming this spring,https://www.theverge.com/2020/2/10/21131332/motorola-razr-gold-color-verizon-launch-release
556,Leaked images appear to show the LG V60 ThinQ’s four cameras and a big battery,https://www.theverge.com/2020/2/10/21131247/lg-v60-thinq-leaked-photos-4-cameras-5000mah-battery
557,"Designing a more friendly Fortnite with food, puns, and no in-app purchases",https://www.theverge.com/2020/2/10/21128166/butter-royale-apple-arcade-iphone-ipad-fortnite-mighty-bear-games-interview
558,Sen. Josh Hawley proposes FTC overhaul to take on Google and Facebook,https://www.theverge.com/2020/2/10/21131212/hawley-ftc-proposal-antitrust-doj-big-tech
559,Samsung’s Galaxy S20 is a make-or-break moment for 5G,https://www.theverge.com/2020/2/10/21128425/samsung-galaxy-s20-snapdragon-865-5g-tmobile-att-verizon-sprint-network
560,ARM’s new edge AI chips promise IoT devices that won’t need the cloud,https://www.theverge.com/2020/2/10/21130800/arm-new-edge-ai-chips-processing-npu-cortex-m55-u55-iot
561,Fashion edition Galaxy Z Flip leaks in weirdo promo,https://www.theverge.com/2020/2/10/21131178/thom-browne-galaxy-z-fashion-edition-foldable-handset
562,Samsung’s Galaxy Home Mini caught on video ahead of rumored Wednesday release,https://www.theverge.com/2020/2/10/21131144/samsung-galaxy-home-mini-leaked-video-screenshots-ir-blaster-functionality
563,Microsoft’s Surface Duo appears in the wild in new video,https://www.theverge.com/2020/2/10/21131130/microsoft-surface-duo-video-leak-software-pre-release-features
564,Samsung’s Galaxy Buds Plus detailed in new hands-on video,https://www.theverge.com/2020/2/10/21131120/samsung-galaxy-buds-leaked-hands-on-video-winfuture-roland-quandt
565,Taika Waititi slams Apple’s MacBook keyboards after winning first Oscar,https://www.theverge.com/2020/2/9/21130967/oscars-taika-waititi-apple-butterfly-keyboards-jojo-rabbit-academy-award-press-room
566,Samsung aired a Galaxy Z Flip commercial before it even announced the phone,https://www.theverge.com/2020/2/9/21130777/samsung-oscars-galaxy-z-flip-ad-commercial-tease-2020
567,Oscars 2020: how to watch the Academy Awards online,https://www.theverge.com/2020/2/9/21123015/oscars-2020-live-stream-watch-how-to-online-academy-awards-start-time
568,From The Strategist: the best running hydration packs and water bottles,https://www.theverge.com/2020/2/9/21120695/best-running-hydration-packs-water-bottles-runners-strategist
569,Cruise lines ban Chinese passport holders over coronavirus fears,https://www.theverge.com/2020/2/7/21128468/ships-coronavirus-ban-royal-caribbean-norwegian-cruise-outbreak-passports
570,"This weekend, save on the 16-inch MacBook Pro, truly wireless earphones, and the PS4 Pro",https://www.theverge.com/good-deals/2020/2/8/21128650/16-inch-macbook-pro-apple-amazon-anker-truly-wireless-earphones-ps4-pro-deal-sale
571,Watch Motorola’s ‘real’ flip test for the new Razr foldable,https://www.theverge.com/2020/2/7/21128914/motorola-razr-real-flip-test-phone
572,"Nvidia is no longer attending Mobile World Congress, citing coronavirus risk",https://www.theverge.com/2020/2/7/21128857/coronavirus-nvidia-cancel-mobile-world-congress-mwc-2020
573,The NFL account hijackers just compromised Facebook’s Twitter and Instagram accounts,https://www.theverge.com/2020/2/7/21128779/facebook-twitter-messenger-account-ourmine-hacked-nfl
574,DOJ drops antitrust probe into automakers that want cleaner cars,https://www.theverge.com/2020/2/7/21128684/doj-antitrust-investigation-closed-trump-ford-vw
