290,How your browser protects your privacy,https://www.theverge.com/2020/2/20/21136728/browser-privacy-protection-features-safety-how-to-data-edge-safari-chrome
291,Apple considers allowing apps like Chrome and Gmail to be set as iOS defaults,https://www.theverge.com/2020/2/20/21145227/apple-third-party-apps-default-report-browser-mail-music-homepod
292,Google shifts authority over UK user data to the US in wake of Brexit,https://www.theverge.com/2020/2/20/21145180/google-uk-user-data-processing-ireland-usa-authorities-data-protection-gdpr-cloud-act
293,"Android 11 will fix dozens of small annoyances, but what about the apps?",https://www.theverge.com/2020/2/20/21144808/android-11-new-features-updates-apps-api-quality
294,A new generation of social apps is trying to make you feel better about yourself,https://www.theverge.com/interface/2020/2/20/21143979/ikaria-app-just-imagine-chrys-bader-secret-social-network-wellness
295,Microsoft rolls out colorful new Windows 10 icons,https://www.theverge.com/2020/2/20/21145157/microsoft-windows-10-new-icons-modern-release-update-apps
296,Samsung blasts Galaxy phones worldwide with weird ‘1’ notification,https://www.theverge.com/2020/2/20/21145130/samsung-find-my-mobile-app-1-notification-galaxy
297,Asus graphics cards are allegedly overheating because the screws are too loose,https://www.theverge.com/2020/2/19/21144801/amd-graphics-card-gpu-overheat-loose-screw-pressure
298,George Zimmerman sues Warren and Buttigieg for $265 million over ‘defamatory’ Travyon Martin tweets,https://www.theverge.com/2020/2/19/21144670/george-zimmerman-lawsuit-warren-buttigieg-travyon-martin-defamation-tweets
299,The most interesting new Android 11 features so far,https://www.theverge.com/2020/2/19/21144548/google-android-11developer-preview-best-new-features-hands-on-5g-messaging-bubbles-privacy-location
300,Boston Dynamics’ Spot isn’t quite the terrifying robot hunter you think it is,https://www.theverge.com/2020/2/19/21144648/boston-dynamics-spot-robot-mass-state-police-trial-issues
301,"Larry Tesler, the UI pioneer responsible for cut, copy, and paste, dies at 74",https://www.theverge.com/2020/2/19/21144516/larry-tesler-cut-copy-paste-dies-at-74-apple-xerox-amazon-obituary
302,Sling TV loses subscribers for the first time as streaming competition grows,https://www.theverge.com/2020/2/19/21144365/sling-tv-dish-subscribers-loss-youtube-hulu
303,This website creates karaoke song versions of any YouTube video,https://www.theverge.com/tldr/2020/2/19/21144452/youtube-youka-club-karaoke-lyrics
304,Facebook sued by the IRS for $9 billion in unpaid taxes,https://www.theverge.com/2020/2/19/21144291/facebook-irs-lawsuit-9-billion-taxes
305,Flywheel will shut down its virtual classes after admitting it illegally copied Peloton,https://www.theverge.com/2020/2/19/21144268/flywheel-digital-classes-shut-down-peloton-exercise-trade-in
306,Dish Network floats merger with DirecTV over pace of cord-cutting,https://www.theverge.com/2020/2/19/21144345/dish-network-merger-directv-streaming-services-subscribers-q4-2019
307,The Oakland A’s have (mostly) ditched the radio for the internet,https://www.theverge.com/2020/2/19/21144224/oakland-a-cast-tunein-mlb-exclusive-live-games-radio-show-app
308,How to mute a single word on Twitter,https://www.theverge.com/2020/2/19/21144097/twitter-mute-tweets-word-name-tag-how-to-settings-phone-desktop
309,"Zero unveils the SR/S, the ‘Gulfstream’ of electric motorcycles",https://www.theverge.com/2020/2/19/21144093/zero-srs-electric-motorcycle-bike-speed-mile-range-photos-price
310,Qualcomm’s new X60 modems promise future 5G phones will be faster and more power efficient,https://www.theverge.com/2020/2/19/21142381/qualcomm-x60-modem-5g-phones-faster-power-efficient-5nm-carrier
311,Apple tries to halt publication of App Store book allegedly containing company secrets,https://www.theverge.com/2020/2/19/21144053/apple-publication-book-app-store-confidential-tom-sadowski
312,Google Docs’ latest Smart Compose feature makes the service more like Microsoft Word,https://www.theverge.com/2020/2/19/21144066/google-docs-smart-compose-ai-microsoft-word-email
313,Nerf is bringing back three original Super Soakers this spring,https://www.theverge.com/2020/2/19/21144075/super-soaker-100-20-30-hasbro-nerf-announcement
314,Sony is skipping Pax East convention over coronavirus concerns,https://www.theverge.com/2020/2/19/21144121/sony-playstation-pax-east-coronavirus-cancel-last-of-us-part-2-dreams
315,How photoshop became a verb,https://www.theverge.com/2020/2/19/21143794/photoshop-30th-anniversary-adobe-verb-origin-story
316,Google releases Android 11 developer preview earlier than expected,https://www.theverge.com/2020/2/19/21143789/google-android-11-developer-preview-release-5g-security-early
317,Some Staples stores in Boston are getting podcast studios,https://www.theverge.com/2020/2/19/21143803/staples-connect-spreaker-podcast-studio-rental-boston
318,How to live stream tonight’s 2020 Democratic debate,https://www.theverge.com/2020/2/19/21143861/democratic-debate-watch-live-stream-how-to-start-time-candidates-bernie-sanders-bloomberg
319,You can now set Sonos speakers as the default playback option for Google Assistant,https://www.theverge.com/2020/2/19/21143988/sonos-google-assistant-default-playback-device-speakers-settings-update
320,Nissan launches a subscription service starting at $699 a month,https://www.theverge.com/2020/2/19/21143852/nissan-switch-subscription-service-price-model-vehicle
321,"Folding glass: how, why, and the truth of Samsung’s Z Flip",https://www.theverge.com/2020/2/19/21142728/samsung-foldable-glass-galaxy-z-flip-explained-schott-corning
322,Fortnite’s next season needs to tell a good story,https://www.theverge.com/2020/2/19/21143878/fortnite-chapter-2-next-season-2-good-story
323,How to use Vivaldi’s tools to protect your privacy while browsing,https://www.theverge.com/2020/2/19/21137843/vivaldi-privacy-tools-private-network-browser-settings-security
324,Uber introduces new feature to let riders ‘discreetly’ snitch on their drivers,https://www.theverge.com/2020/2/19/21143679/uber-rider-reporting-safety-issue-driver-trip
325,Microsoft’s new Office app arrives on iOS and Android with mobile-friendly features,https://www.theverge.com/2020/2/19/21143517/microsoft-office-app-android-ios-release-download-word-excel-powerpoint
326,The Beats Solo Pro are back down to their lowest price,https://www.theverge.com/good-deals/2020/2/19/21143696/beats-bose-headphones-deal-sale-sonos-ipad-amazon
327,TikTok is letting parents set how much time their kids can spend on the app,https://www.theverge.com/2020/2/19/21143673/tiktok-family-safety-mode-screen-time-management-messages-restricted
328,"As Google heads to the Supreme Court, Oracle takes aim at its industry allies",https://www.theverge.com/2020/2/19/21142366/google-supreme-court-oracle-java-copyright-microsoft-ibm
329,"How climate scientists, activists, and NGOs want to spend Jeff Bezos’ money",https://www.theverge.com/2020/2/19/21143044/jeff-bezos-climate-change-donation-scientists-earth-fund-activists-ngo
330,Groupon is abandoning its physical goods store,https://www.theverge.com/2020/2/19/21143595/groupon-products-physical-sales-ended-experiences
331,"In honor of Photoshop’s 30th birthday, watch this video of Photoshop version 1",https://www.theverge.com/2020/2/19/21128404/adobe-photoshop-30-years-version-1
332,Alphabet winds down energy kite division,https://www.theverge.com/2020/2/19/21143540/alphabet-discontinues-makani-flying-wind-turbine-drone-kites-clean-energy
333,"Foldable phones can’t catch a break, mainly because they keep breaking",https://www.theverge.com/tech/2020/2/19/21143293/foldable-phones-breaking-razr-z-flip-fold-samsung-motorla
334,Facebook’s proposed regulations are just things it’s already doing,https://www.theverge.com/interface/2020/2/19/21142478/facebook-regulation-content-moderation-singapore-pakistan
335,Samsung’s Z Flip glass covering is ready for non-Samsung foldables,https://www.theverge.com/2020/2/19/21143505/samsung-display-ultra-thin-glass-foldable-display-galaxy-z-flip-commercialized
336,Electric Citi Bikes are back after braking malfunction grounded the fleet,https://www.theverge.com/2020/2/19/21142346/citi-bike-electric-ebike-nyc-return-brake-malfunction
337,Galaxy Z Flip teardown reveals that its hinge brushes may not block much dust,https://www.theverge.com/2020/2/18/21142748/samsung-galaxy-z-flip-teardown-ifixit-jerryrigeverything-hinge-brushes-screen
338,Activision Blizzard exec leaks that Overwatch might become a TV series,https://www.theverge.com/2020/2/18/21142093/activision-blizzard-overwatch-diablo-tv-show-netflix
339,An Indian politician used AI to translate his speech into other languages to reach more voters,https://www.theverge.com/2020/2/18/21142782/india-politician-deepfakes-ai-elections
340,Iron Man dreams are closer to becoming a reality thanks to this new Jetman Dubai video,https://www.theverge.com/tldr/2020/2/18/21142603/jetman-dubai-pilot-video-watch-jetpack-iron-man-autonomous-human-flight
341,The best smart display to buy right now,https://www.theverge.com/2020/2/18/21139800/best-smart-display-home-amazon-google-alexa-assistant-echo-nest
342,Adobe’s product chief explains how pro apps are changing in response to TikTok,https://www.theverge.com/2020/2/18/21137875/adobe-product-chief-scott-belsky-pro-apps-changing-tiktok-vergecast
343,Jaguar Land Rover unveils ‘autonomy ready’ electric shuttle concept,https://www.theverge.com/2020/2/18/21142427/jaguar-land-rover-electric-shuttle-mobility-concept
344,"Google Stadia is coming to Samsung, Asus, and Razer phones on February 20th",https://www.theverge.com/2020/2/18/21142463/google-stadia-android-phones-pixel-samsung-razer-asus-rog
345,Patreon will now give creators cash advances on their subscription money,https://www.theverge.com/2020/2/18/21142306/patreon-capital-loans-jack-conte-cash-advances
346,Apple’s location-tracking Tags might finally launch later this year,https://www.theverge.com/2020/2/18/21142249/apple-tags-iphone-kuo-location-tracking
347,Kickstarter employees vote to unionize,https://www.theverge.com/2020/2/18/21142308/kickstarter-employee-vote-union-unionize
348,Apple Music now groups different versions of the same albums,https://www.theverge.com/2020/2/18/21142234/apple-music-different-versions-same-albums-remaster-deluxe-editions
349,Porsche Taycan catches fire in Florida,https://www.theverge.com/2020/2/18/21142123/porsche-taycan-electric-ev-fire-florida
350,"Save on leather iPhone cases, the 16-inch MacBook Pro, and more",https://www.theverge.com/good-deals/2020/2/18/21142191/apple-leather-iphone-xs-max-11-pro-cases-16-macbook-pro-deal-sale
351,SpaceX will launch private citizens into orbit,https://www.theverge.com/2020/2/18/21142137/spacex-tourism-orbit-earth-private-citizens-dragon-space-flight
352,Volocopter and Grab team up to explore air taxi service in Southeast Asia,https://www.theverge.com/2020/2/18/21142095/volocopter-grab-air-taxi-southeast-asia-cities-electric-aircraft
353,"Marshall adds active noise cancellation to its over-ear headphones, now with USB-C",https://www.theverge.com/2020/2/18/21138304/marshall-headphones-monitor-2-usb-c-noise-cancellation-specs-price
354,Ring enables mandatory two-factor authentication and new privacy controls in response to scandals,https://www.theverge.com/2020/2/18/21141948/ring-two-factor-authentication-default-mandatory-data-sharing-third-party-analytics-advertising
355,Go read this story about the failed pizzas-made-by-robots-and-cooked-during-delivery startup,https://www.theverge.com/2020/2/18/21141969/zume-pizza-failure-softbank-founder-cult
356,Coronavirus impact on tech industry predicted in new report,https://www.theverge.com/2020/2/18/21141924/coronavirus-tech-industry-impact-report-trendforce
357,A Motorola Razr’s screen is reportedly peeling right on the fold,https://www.theverge.com/2020/2/17/21141471/motorola-razr-screen-peeling-right-on-the-fold-input
358,"Ring cameras can help you spy on your neighbors, but they haven’t really helped police",https://www.theverge.com/2020/2/17/21141336/amazon-ring-cameras-spy-neighbors-police-nbc-news-intelligencer
359,Apple warns revenue will be lower than expected because of coronavirus impact,https://www.theverge.com/2020/2/17/21141346/apple-miss-revenue-guidance-coronavirus-constrained-iphone-supply
360,A playable build of the never-released StarCraft: Ghost has apparently leaked online,https://www.theverge.com/2020/2/17/21141203/starcraft-ghost-playable-build-leaked-xbox-blizzard
361,Go read this report on how the coronavirus is pushing Chinese concerts online,https://www.theverge.com/2020/2/17/21141120/coronavirus-quarantine-china-music-festivals-club-nights-livestream-hyperallergic
362,"Watch the first trailer for ‘Amazing Stories,’ Steven Spielberg’s Apple TV Plus show",https://www.theverge.com/2020/2/17/21141114/apple-tv-plus-trailer-steven-spielberg-show-amazing-stories
363,Jeff Bezos commits $10 billion to fight climate change,https://www.theverge.com/2020/2/17/21141132/jeff-bezos-earth-fund-ten-billion-climate-change
364,New email scheme threatens to get websites kicked off Google AdSense unless they pay bitcoin,https://www.theverge.com/2020/2/17/21140911/email-scheme-google-adsense-bitcoin
365,SpaceX loses Falcon 9 booster at sea after successful Starlink launch,https://www.theverge.com/2020/2/17/21140965/spacex-falcon-9-failure-sea-drone-ship-starlink-success
366,"Justin Bieber was accused of stealing a melody, but it’s actually a royalty-free sample you can buy online",https://www.theverge.com/2020/2/17/21140838/justin-bieber-changes-running-over-asher-monroe-synergy-splice-sample-melody
367,"Leaked images show TCL prototype phone with expandable, slide-out display",https://www.theverge.com/2020/2/17/21140897/tcl-slide-out-screen-foldable-device-leaked-images
368,Google winds down free Station Wi-Fi program,https://www.theverge.com/2020/2/17/21140698/google-station-discontinued-free-wifi-india-south-africa-railway-stations
369,Tesla forced to pause Berlin Gigafactory after environmental challenge,https://www.theverge.com/2020/2/17/21140666/tesla-gigafactory-4-berlin-gruenheide-environmental-protest-pause
370,Galaxy Z Flip durability test calls Samsung’s Ultra Thin ‘Glass’ into question,https://www.theverge.com/2020/2/16/21139897/samsung-galaxy-z-flip-ultra-thin-glass-durability-scratch-test-jerryrigeverything
371,From The Strategist: the 16 best bikes for beginning commuters,https://www.theverge.com/2020/2/16/21136215/best-bikes-beginner-commuters-strategist
372,Here are a few great Presidents’ Day deals,https://www.theverge.com/good-deals/2020/2/15/21137623/presidents-day-deals-tech-wireless-headphones-gaming-consoles-laptops
373,"You can blame Nvidia, not just Activision Blizzard, for their GeForce Now falling-out",https://www.theverge.com/2020/2/14/21138479/nvidia-geforce-now-activision-blizzard-misunderstanding
374,Google removes alleged spying app ToTok from the Play Store for a second time,https://www.theverge.com/2020/2/14/21138522/google-removes-totok-play-store-spying-app-uae
375,Fortnite now lets you Rickroll your friends,https://www.theverge.com/2020/2/14/21138550/fortnite-rickroll-new-emote-never-gonna-give-you-up-rick-astley
376,Apple now lets you shop directly in augmented reality,https://www.theverge.com/2020/2/14/21138536/apple-ios-ipad-os-quick-look-ar-augmented-reality-shopping-apple-pay
377,Redbox launches an ad-supported streaming TV service,https://www.theverge.com/2020/2/14/21138485/redbox-free-live-tv-ad-supported-streaming-platform-launch-rollout
378,Facebook cancels global marketing conference due to the coronavirus outbreak,https://www.theverge.com/2020/2/14/21138480/facebook-global-marketing-conference-canceled-coronavirus
379,"HQ, maker of the once-popular HQ Trivia, is shutting down",https://www.theverge.com/2020/2/14/21138408/hq-trivia-shutting-down-employee-layoffs-app-game
380,Michigan computer science faculty calls for Jason Mars to take a leave of absence following Verge investigation,https://www.theverge.com/2020/2/14/21138326/university-of-michigan-faculty-clinc-ai-jason-mars-allegations-leave-of-absence
381,Go read this grim Motherboard report about what it’s like to work at Target delivery company Shipt,https://www.theverge.com/2020/2/14/21138321/motherboard-report-target-delivery-company-shipt-gig-economy
382,Apple might use its own 5G antenna in its 2020 iPhones,https://www.theverge.com/2020/2/14/21138264/apple-5g-antenna-qualcomm-x55-modem-mmwave-iphone-2020-rumor
383,IRS backtracks on whether video game currencies are taxable,https://www.theverge.com/2020/2/13/21137045/irs-provision-virtual-currency-tax-returns-fortnite-v-bucks
384,"Podcasters want an awards show, so they’re trying to start one",https://www.theverge.com/2020/2/14/21138119/golden-mics-awards-podcasting-academy-launch
385,GameSnacks are Google’s new HTML5 games designed for bad internet connections,https://www.theverge.com/2020/2/14/21137737/gamesnacks-google-html5-games-area-120-bad-internet-connection-budget-phones
386,Australian dentist wants to know who wrote that negative Google review,https://www.theverge.com/2020/2/14/21138043/australia-dentist-google-review-defamation
387,Ousted WeWork founder Adam Neumann lists his Manhattan penthouse for $37.5 million,https://www.theverge.com/2020/2/14/21138022/adam-neumann-wework-founder-nyc-penthouse-gramercy-park
388,Perry Bible Fellowship’s Nicholas Gurewitch on making comics for the internet’s golden age,https://www.theverge.com/2020/2/14/21136498/perry-bible-fellowship-nicholas-gurewitch-webcomic-dark-horse
389,"Canceling your Stadia Pro subscription is easy, and you won’t lose your paid games",https://www.theverge.com/2020/2/14/21136594/google-stadia-pro-subscription-free-trial-cancel-paid-games
390,Google might start paying news publishers for content,https://www.theverge.com/2020/2/14/21137811/google-news-feature-publishers-pay-licensing-product
391,Amazon patent imagines using a giant whip to yeet payloads into space,https://www.theverge.com/tldr/2020/2/14/21137791/amazon-new-patent-whip-payloads-launch-space-aerial-craft
392,Reddit’s Female Dating Strategy offers women advice — and a strict rulebook for how to act,https://www.theverge.com/2020/2/14/21137852/reddit-female-dating-advice-strategy-women-rulebook-memes
393,California court says Apple Store workers must be paid for time spent waiting to be searched,https://www.theverge.com/2020/2/14/21137580/apple-store-retail-employees-search-california-supreme-court
394,"Vergecast: Motorola Razr review, Samsung’s Galaxy S20 event, and T-Mobile and Sprint allowed to merge",https://www.theverge.com/2020/2/14/21137704/motorola-razr-review-samsung-galaxy-s20-event-tmobile-sprint-merger-vergecast-podcast
395,I climbed onto my roof for this Pearl Jam app,https://www.theverge.com/2020/2/14/21137645/pearl-jam-artificial-reality-app-superblood-wolfmoon-gigaton
396,Facebook won’t catalog sponsored Mike Bloomberg memes as political ads,https://www.theverge.com/2020/2/14/21137719/facebook-bloomberg-memes-influencer-campaign-ads-election-2020
397,We still haven’t seen the Galaxy Home — and that’s a good thing,https://www.theverge.com/2020/2/14/21136224/samsung-galaxy-home-bixby-not-released
398,Netflix’s first Stranger Things 4 trailer teases the return of a missing friend,https://www.theverge.com/2020/2/14/21137590/netflix-stranger-things-4-trailer-character-teaser-missing-return
399,Windows 10X has already been installed on a MacBook and a Surface Go,https://www.theverge.com/2020/2/14/21137559/microsoft-windows-10x-install-macbook-surface-go-emulator-operating-system
400,How to use Brave’s tools to protect your privacy while browsing,https://www.theverge.com/2020/2/14/21128019/brave-privacy-tools-private-network-browser-settings-security
401,Trump’s impeachment is over — but what about the podcasts?,https://www.theverge.com/2020/2/14/21134825/trump-impeachment-trial-podcast-strategy-rss-feed-wnyc-daily-dc
402,PS4 game Dreams is an amazing creation tool with an exposure problem,https://www.theverge.com/2020/2/14/21136244/dreams-ps4-game-creation-tool-exposure-problem-curation-media-molecule
403,Flip phones deserve a shot because phones all look the same now,https://www.theverge.com/tech/2020/2/14/21137184/folding-phone-flip-form-factor-razr-galazy-z-fold
404,Samsung’s busted union buster quits,https://www.theverge.com/2020/2/14/21137455/samsung-electronics-board-chairman-resigns-jail-union-sabotage
405,Spot is surprisingly good at pulling Adam Savage in a rickshaw,https://www.theverge.com/2020/2/14/21137444/boston-dynamics-spot-robodot-robotic-dog-rickshaw-adam-savage-mythbusters-tested
406,RFID sensor is powered by dirty diapers,https://www.theverge.com/2020/2/14/21137424/mit-smart-diaper-sensor-smartphone-alerts
407,Google appeases Stadia subscribers with the first new game announcements since launch,https://www.theverge.com/2020/2/14/21136531/google-stadia-new-games-panzer-dragoon-serious-sam-lost-worlds-splitlings-stacks
408,Sony reportedly battling to keep PlayStation 5 price down,https://www.theverge.com/2020/2/14/21137392/sony-ps5-price-cost-of-manufacture-psvr-2-report
409,Facebook quietly releases a Pinterest clone,https://www.theverge.com/2020/2/13/21136898/facebook-pinterest-photo-sharing-app
410,Roku predicts half of US households with a TV will cut the cord by 2024,https://www.theverge.com/2020/2/13/21136854/roku-us-homes-cord-cutting-content-partners-advertising-fox-nbc
411,‘Disgruntled’ former Waymo self-driving car operator arrested for causing car crash,https://www.theverge.com/2020/2/13/21136878/waymo-disgruntled-employee-self-driving-car-crash-autonomous
412,Tesla owner says remotely disabled Autopilot features have been restored,https://www.theverge.com/2020/2/13/21136699/tesla-autopilot-used-model-s-owner-restored-assistance-features
413,DOJ charges Ohio man with laundering over $300 million via bitcoin,https://www.theverge.com/2020/2/13/21136749/doj-ohio-helix-bitcoin-darknet-cryptocurrency-laundering-crime
414,"Apple’s new 16-inch MacBook Pro is now available refurbished, starting at $2,039",https://www.theverge.com/good-deals/2020/2/13/21136787/apple-16-inch-macbook-pro-laptop-keyboard-deal-refurbished-sale
415,Walmart’s text message-based Jetblack shopping service shuts down,https://www.theverge.com/2020/2/13/21136752/walmart-jetblack-personal-shopping-service-shutdown-delivery-orders-competition
416,YouTube TV will cancel subscriptions of customers using Apple’s in-app payments in March,https://www.theverge.com/2020/2/13/21136730/youtube-tv-ending-apple-app-store-in-app-subscription
417,Arrested Huawei executive hit with new US charges ahead of extradition,https://www.theverge.com/2020/2/13/21136623/huawei-wanzhou-meng-doj-trade-secrets-justice-department-zte-china
418,"Apple will reopen its five Beijing stores on February 14th, with limited hours",https://www.theverge.com/2020/2/13/21136648/apple-beijing-stores-reopen-february-14th-limited-hours-coronavirus
419,Oracle strikes back at Google in Supreme Court copyright case,https://www.theverge.com/2020/2/13/21136492/oracle-google-supreme-court-copyright-java-response-trial
420,How to use Pokémon Home to move your pokédex between games,https://www.theverge.com/2020/2/13/21134790/pokemon-home-pokedex-transporter-move-3ds-games-switch-android-ios
421,"YouTube is the frontrunner in the mobile streaming wars, and it’s not even close",https://www.theverge.com/2020/2/13/21136335/youtube-streaming-wars-mobile-android-tiktok-netflix-quibi
422,Half-Life: Alyx will launch on March 23rd,https://www.theverge.com/2020/2/13/21136678/half-life-alyx-launching-march-23rd-date-valve-announcement
423,Bloomberg hired Fyre Festival promoters to make his campaign memes,https://www.theverge.com/2020/2/13/21136160/bloomberg-2020-meme-instagram-influencers-campaign-marketing-fyre-festival-promoters
424,Amazon pauses Microsoft’s $10 billion Pentagon contract as trial proceeds,https://www.theverge.com/2020/2/13/21136641/amazon-microsoft-pentagon-contract-jedi-10-billion-paused
425,"Blockchain voting app is dangerously vulnerable, researchers say",https://www.theverge.com/2020/2/13/21136219/voatz-blockchain-voting-app-election-software-hacking-mit-research-cybersecurity
426,Apple files patent for a smart home system that could configure itself,https://www.theverge.com/2020/2/13/21136368/apple-patent-smart-home-tech-configure-itself-tof-uwb
427,MSI Prestige 14 review: hot pink and hot in your lap,https://www.theverge.com/2020/2/13/21136283/msi-prestige-14-review-laptop-specs-price-pink-content-creator
428,You can now directly sync Apple Watch workouts to Strava,https://www.theverge.com/2020/2/13/21136425/apple-watch-strava-ios-healthkit-update-sync-workouts-directly
429,"AR Pianist app is fun to watch, but that’s about it",https://www.theverge.com/2020/2/13/21136248/ar-pianist-massive-technologies-virtual-musicians-pianos
430,How to use Edge’s tools to protect your privacy while browsing,https://www.theverge.com/2020/2/13/21125411/microsoft-edge-pc-privacy-tools-private-network-browser-settings
431,The Galaxy S20 is the first high-refresh display phone many people will own,https://www.theverge.com/2020/2/13/21135446/galaxy-s20-high-refresh-rate-display-phone-120hz-google-pixel-oneplus-7-pro
432,Tesla launches $2 billion stock offering after Elon Musk said ‘it doesn’t make sense’,https://www.theverge.com/2020/2/13/21136164/tesla-2-billion-stock-offering-elon-musk-cash-raise
