1,Epic delays Fortnite tournaments until it fixes performance issues,https://www.theverge.com/2020/3/2/21162003/epic-delays-fortnite-tournaments-fixes-performance-issues-world-cup
2,Waymo rakes in $2.25 billion in self-driving unit’s first external fundraising,https://www.theverge.com/2020/3/2/21162061/waymo-outside-investment-amount-autonation-magna-silver-lake
3,The Google Pixel Slate tablet includes a keyboard and pen for $599,https://www.theverge.com/good-deals/2020/3/2/21161957/google-pixel-slate-tablet-chromebook-keyboard-pen-free-bundle-599
4,Uber and Lyft give drivers guidelines to help prevent coronavirus spread,https://www.theverge.com/2020/3/2/21161932/uber-lyft-coronavirus-driver-guidance-travel-restrictions
5,"Go read this bonkers profile of Rebekah Neumann, co-founder of WeWork",https://www.theverge.com/2020/3/2/21161614/wework-rebekah-neumann-co-founder-bustle-profile-recommendation
6,NBC’s experimental PGA Tour live stream makes it easier to follow your favorite golfer,https://www.theverge.com/2020/3/2/21161455/players-championship-pga-live-stream-cameras-course-nbc-sports-gold
7,Facebook restricts social visitors to its offices over coronavirus concerns,https://www.theverge.com/2020/3/2/21161841/coronavirus-facebook-visitor-restriction-job-interview-video
8,Android 11 can tell you when your Pixel 4 isn’t placed correctly on a wireless charger,https://www.theverge.com/2020/3/2/21161415/android-11-pixel-4-xl-wireless-charger-placement-warning-feature
9,How to make your own hand sanitizer,https://www.theverge.com/2020/3/2/21161346/hand-sanitizer-diy-how-to-hand-wash-cdc-alcohol-virus-illness
10,Apple Pro Display XDR review: category of one,https://www.theverge.com/2020/3/2/21161487/apple-mac-pro-display-xdr-review-6k-lcd-screen-price-features
11,"Mac Pro review: power, if you can use it",https://www.theverge.com/2020/3/2/21161358/mac-pro-review-apple-display-xdr-adobe-hardware-software-price-video
12,"New Google Pixel features coming this month include more emoji, dark mode scheduling, and Google Pay improvements",https://www.theverge.com/2020/3/2/21161644/pixel-feature-drop-inclusive-emoji-ar-effects-dark-mode-google-pay
13,Nvidia’s GPU Technology Conference will now be online only due to coronavirus concerns,https://www.theverge.com/2020/3/2/21161635/nvidias-gpu-technology-conference-gtc-online-only-coronavirus
14,The new Facebook Messenger for iOS is much faster and takes less space on your phone,https://www.theverge.com/2020/3/2/21161533/facebook-messenger-ios-app-faster-simpler-smaller
15,"10,000 UK railway users had details leaked by free Wi-Fi provider",https://www.theverge.com/2020/3/2/21161387/uk-railway-stations-free-wi-fi-exposed-london-bridge
16,Death Stranding is coming to PC on June 2nd with Half-Life cosmetics,https://www.theverge.com/2020/3/2/21161413/death-stranding-pc-june-2nd-half-life-headcrab-steam-epic-games-store
17,Apple agrees to $500 million settlement for throttling older iPhones,https://www.theverge.com/2020/3/2/21161271/apple-settlement-500-million-throttling-batterygate-class-action-lawsuit
18,How to save a tweet as a draft,https://www.theverge.com/2020/3/2/21161213/twitter-tweet-draft-save-as-how-to
19,Amazon’s waterproof Kindle Paperwhite is back down to its lowest price,https://www.theverge.com/good-deals/2020/3/2/21161192/amazon-kindle-paperwhite-deal-sale-apple-homepod-google-pixelbook
20,Core is a new platform aiming to be the YouTube of game development,https://www.theverge.com/2020/3/2/21158189/core-free-game-creation-tool-pc-youtube-twitch
21,"Jeep’s high performance electric bike is now available for pre-order, but you probably can’t afford it",https://www.theverge.com/2020/3/2/21161230/jeep-ebike-electric-bike-quietkat-manufacturer-preorder-price-specs-date
22,Twitter pulls out of SXSW conference over coronavirus concerns,https://www.theverge.com/2020/3/2/21161169/twitter-sxsw-coronavirus-employee-travel-jack-dorsey
23,Public media found its answer to Spotify in Pocket Casts,https://www.theverge.com/2020/3/2/21161094/pocket-casts-podcasts-spotify-bbc-studios-investment-npr-american-life
24,Microsoft’s translucent Xbox controller looks the best in new pink option,https://www.theverge.com/2020/3/2/21161174/microsoft-xbox-phantom-controller-pink-preorder-release-date-price
25,The Verge tech survey 2020,https://www.theverge.com/2020/3/2/21144680/verge-tech-survey-2020-trust-privacy-security-facebook-amazon-google-apple
26,Alphabet’s Tidal moonshot tracks individual fish to help sustainably feed humanity,https://www.theverge.com/2020/3/2/21161029/tidal-moonshot-sustainable-fish-farms
27,Oppo launches six-camera Reno 3 Pro in India,https://www.theverge.com/2020/3/2/21161002/oppo-reno-3-pro-hands-on-price-specs-india
28,AT&T TV now available nationwide with Android TV set-top box — and a two-year contract,https://www.theverge.com/2020/3/2/21160860/att-tv-now-available-android-tv-google-assistant-streaming
29,Sharp will use a TV factory to mass-produce face masks,https://www.theverge.com/2020/3/1/21160879/coronavirus-face-masks-sharp-japan-factory-production
30,Mike Bloomberg cosplays as president in coronavirus ad,https://www.theverge.com/2020/3/1/21160735/mike-bloomberg-coronavirus-covid19-cbs-nbc-ad-president-oval-office
31,From The Strategist: the 10 best eco-friendly condoms and lubes,https://www.theverge.com/2020/3/1/21151694/condoms-lubes-best-eco-friendly-strategist
32,First U.S. coronavirus death confirmed in Washington state,https://www.theverge.com/2020/2/29/21159204/coronavirus-us-death-washington-king-county
33,This is the last week to preorder Samsung’s Galaxy S20,https://www.theverge.com/good-deals/2020/2/29/21158013/samsung-galaxy-s20-preorder-deal-gift-card-trade-in-google-nest-hub
34,YouTube TV will keep streaming Fox RSNs and YES Network during negotiations with Sinclair,https://www.theverge.com/2020/2/29/21159033/youtube-tv-sinclair-fox-regional-sports-networks-yes-network-extension
35,How to stop Spectrum junk mail,https://www.theverge.com/2020/2/29/21157801/stop-spectrum-junk-mail-how-to-spam-calls-online-form
36,"1More True Wireless ANC headphones review: great features, not-so-great fit",https://www.theverge.com/2020/2/29/21157701/1more-true-wireless-anc-headphones-review-noise-canceling-earbuds-price-performance-features
37,Hilary Duff publicly asks Disney to move Lizzie McGuire reboot to Hulu instead of Disney Plus,https://www.theverge.com/2020/2/28/21158617/hilary-duff-wants-lizzie-mcguire-on-hulu-not-disney-plus
38,The Internet Archive’s VHS Vault will send you on a 90s nostalgia trip,https://www.theverge.com/tldr/2020/2/28/21158457/internet-archive-vhs-vault-tapes-shows-recordings
39,Facebook’s 3D photos can now be made using single-camera phones,https://www.theverge.com/2020/2/28/21158346/facebook-3d-photos-single-camera-phones-neural-network-iphone-android
40,"Byte is about to pay $250,000 to creators for good videos",https://www.theverge.com/2020/2/28/21158220/byte-creator-payouts-starting-april-partner-program-talent
41,Audi announces three-motor performance versions of the E-Tron,https://www.theverge.com/2020/2/28/21158139/audi-etron-s-sportback-triple-motor-performance-electric-geneva-motor-show
42,The World Health Organization has joined TikTok to fight coronavirus misinformation,https://www.theverge.com/2020/2/28/21158276/coronavirus-covid19-tiktok-who-world-health-organization-protection
43,The Catholic Church proposes AI regulations that ‘protect people’,https://www.theverge.com/2020/2/28/21157667/catholic-church-ai-regulations-protect-people-ibm-microsoft-sign
44,Moment will stop developing its Pro Camera app for Android,https://www.theverge.com/2020/2/28/21158102/moment-android-pro-camera-app-play-store-stop-developing
45,Facebook Messenger is getting a much simpler new design,https://www.theverge.com/2020/2/28/21158115/facebook-messenger-discover-tab-removal-instant-games-chatbots-business
46,Google and Amazon limit employees’ travel because of coronavirus fears,https://www.theverge.com/2020/2/28/21158029/google-amazon-travel-coronavirus-covid-china-italy-iran-japan-south-korea
47,Who’s afraid of the novel coronavirus?,https://www.theverge.com/2020/2/28/21157721/severance-coronavirus-cdc-trump-healthcare-outbreak-crisis-panic-twitter
48,Apple made an ad to highlight the history of MacBooks in anime,https://www.theverge.com/2020/2/28/21157828/new-apple-anime-ad-macbooks-laptops-airpods-earpods
49,VW settlement and Porsche raid show Dieselgate fallout hasn’t stopped,https://www.theverge.com/2020/2/28/21157551/volkswagen-settlement-porsche-raid-dieselgate-trial
50,The Vaio SX12 offers too little for too much,https://www.theverge.com/2020/2/28/21153098/vaio-sx12-review-display-design-price-specs-features
51,Microsoft drops Cortana consumer skills in new Windows 10 update,https://www.theverge.com/2020/2/28/21157816/microsoft-cortana-windows-10-productivity-skills-assistant-update
52,"Save on Jabra’s Elite 65t truly wireless earbuds, white noise machines, and more",https://www.theverge.com/2020/2/28/21157497/wireless-earbuds-deal-jabra-elite-65t-white-noise-machine-sale-robot-vacuum
53,Get a closer look at the Xiaomi Mi Mix Alpha in MKBHD’s hands-on video,https://www.theverge.com/2020/2/28/21157597/xiaomi-mi-mix-alpha-display-phone-hands-on-mkbhd-software-youtube
54,Netflix asks court to cancel the Choose Your Own Adventure trademark,https://www.theverge.com/2020/2/28/21157576/netflix-chooseco-bandersnatch-choose-your-own-adventure-trademark-lawsuit
55,Vergecast: Samsung Galaxy S20 Ultra’s camera issues and Bob Iger steps down as Disney CEO,https://www.theverge.com/2020/2/28/21157600/podcast-vergecast-disney-samsung-galaxy-s20-camera-bob-iger-ceo
56,United Airlines suspends routes to Japan amid rising coronavirus fears,https://www.theverge.com/2020/2/28/21157604/united-airlines-japan-route-suspended-coronavirus-waiver-asia
57,"Latest Stadia update hints at free tier launch, YouTube streaming features",https://www.theverge.com/2020/2/28/21157574/google-stadia-update-app-free-tier-youtube-streaming-hints-release
58,Amazon has barred a million products for making false coronavirus claims,https://www.theverge.com/2020/2/28/21157629/amazon-coronavirus-products-misleading-false-claims-price-gouging-face-masks
59,Imagine a world without YouTube,https://www.theverge.com/2020/2/28/21145506/youtube-without-internet-fiction-alternate-history
60,First look at 8K HDR sport streaming coming to the UK this summer,https://www.theverge.com/2020/2/28/21157452/bt-sport-8k-hdr-stream-samsung-qled-tv-hands-on-preview-release-date-premier-league
61,YouTube rarely reinstates removed videos — even when creators appeal,https://www.theverge.com/2020/2/28/21157476/youtube-video-removal-appeal-takedown-community-guidelines-report
62,"Yes, Hillary Clinton will soon have a podcast, too",https://www.theverge.com/2020/2/28/21157458/hillary-clinton-iheartmedia-podcast-launch
63,Apple and Samsung dominate top selling phone lists for 2019,https://www.theverge.com/2020/2/28/21157386/iphone-best-selling-phone-worldwide-xr-11-samsung-a-series-counterpoint-research
64,Mewtwo is nearly impossible to beat in new Pokémon Sword and Shield raid,https://www.theverge.com/2020/2/28/21156710/pokemon-sword-shield-mewtwo-raid-kanto-starters-bulbasaur-charmander-squirtle
65,Dear Apple: don’t let a trackpad turn the iPad into a Mac,https://www.theverge.com/2020/2/28/21156852/apple-ipad-pro-trackpad-rumor-mouse-text-selection-interface-iphone-touch-editorial
66,The Verge Guide to Instagram,https://www.theverge.com/2020/2/28/21121187/instagram-guide-how-to-feed-stories-followers-account-username-privacy-facebook
67,Why we can’t blame social networks for our polarized politics,https://www.theverge.com/interface/2020/2/28/21153060/social-network-polarization-ezra-klein-why-were-polarized-q-a
68,Vivo’s Apex 2020 concept has breakthrough cameras and an ultra-curved screen,https://www.theverge.com/2020/2/28/21157292/vivo-apex-2020-concept-phone-cameras-screen-specs
69,"WeWork’s fall is so wild that it’s getting a second TV series, this one for Apple",https://www.theverge.com/2020/2/27/21156967/wework-apple-tv-plus-second-series-wecrashed-little-america
70,Horror story subreddit goes dark to protest Youtubers ripping off writers,https://www.theverge.com/2020/2/27/21156447/reddit-subreddit-nosleep-horror-story-protest-youtubers-stealing-stories
71,Unions are pushing the FTC to investigate Amazon for anti-competitive practices,https://www.theverge.com/2020/2/27/21156844/amazon-unions-petition-ftc-letter-anticompetitive-antitrust-investigation
72,"Clearview AI’s client list includes 2,200 organizations spanning law enforcement to universities",https://www.theverge.com/2020/2/27/21156678/clearview-ai-client-macy-fbi-doj-twitter-facebook-youtube
73,Apple Arcade’s latest exclusive is a new Crossy Road spinoff,https://www.theverge.com/2020/2/27/21156740/crossy-road-castle-apple-arcade-exclusive-launch-game-release
74,OnlyFans says it wasn’t hacked after hundreds of performers’ videos leak online,https://www.theverge.com/2020/2/27/21156445/onlyfans-leak-not-hacked-photos-videos
75,Google’s new search tools help you find the perfect pop culture GIF,https://www.theverge.com/2020/2/27/21155904/google-gif-search-tools-celebrity-fictional-character-emotions-feelings
76,Instagram 101: How to get started with Instagram,https://www.theverge.com/2020/2/27/21156337/instagram-basics-install-account-username-settings-get-started-how-to
77,Pete Buttigieg is canvassing his Twitter followers ahead of Super Tuesday,https://www.theverge.com/2020/2/27/21156712/pete-buttigieg-twitter-scrape-followers-sanders-bern-app-canvass-super-tuesday
78,Apple reportedly releasing an iPad keyboard with a trackpad later this year,https://www.theverge.com/2020/2/27/21156639/apple-ipad-smart-keyboard-trackpad-pro
79,E-bike startup Wheels lays off staff as dockless micromobility struggles continue,https://www.theverge.com/2020/2/27/21156160/wheels-layoffs-ebike-electric-bike-dockless-micromobility
80,Diaper delivery company Dyper will take back its nappies after use and compost them,https://www.theverge.com/2020/2/27/21155897/diaper-dyper-compost-environment-babies
81,YouTube TV warns customers it might lose Fox’s regional sports networks and YES Network,https://www.theverge.com/2020/2/27/21156521/youtube-tv-fox-rsn-regional-sports-network-yes-sinclair
82,Tim Cook says Apple is reopening factories as China gets ‘coronavirus under control’,https://www.theverge.com/2020/2/27/21156458/apple-ceo-tim-cook-reopening-factories-china-coronavirus-outbreak
83,8chan’s founder is facing arrest for ‘cyberlibel’ in the Philippines,https://www.theverge.com/2020/2/27/21156367/8chan-fredrick-brennan-jim-watkins-cyberlibel-philippines-arrest-warrant
84,YouTube is experimenting with letting creators sell ads directly to brands,https://www.theverge.com/2020/2/27/21156289/youtube-ads-creators-demonetization-brands-adpocalypse-alternative-monetization-sponsorship
85,LinkedIn is testing Snapchat-like stories because that’s the world we live in now,https://www.theverge.com/2020/2/27/21156247/linkedin-testing-instagram-stories-feature-social-network-resumes-why
86,Tinder swipes right on ‘Swipe Night’ by renewing it for a second season,https://www.theverge.com/2020/2/27/21156306/tinder-swipe-night-choose-your-own-adventure-series-second-season
87,It’s hard to care about other people’s feelings online,https://www.theverge.com/2020/2/27/21156102/coronavirus-shooting-trauma-online-anxiety-reaction-therapy
88,YouTube appoints first ‘creator liaison’ as YouTubers demand transparency and answers,https://www.theverge.com/2020/2/27/21155851/youtube-creator-liaison-matt-koval-susan-wojcicki-demonetization-policy-changes
89,Facebook cancels F8 developer conference due to coronavirus concerns,https://www.theverge.com/2020/2/27/21156308/facebook-f8-developer-conference-cancelled-coronavirus-concern-covid-19
90,Nio inks a $1.4 billion bailout as coronavirus sinks sales,https://www.theverge.com/2020/2/27/21155949/nio-hefei-investment-ec6-bailout-coronavirus-china
91,Plague Inc. pulled from the App Store in China amid coronavirus outbreak,https://www.theverge.com/2020/2/27/21156162/plague-inc-pulled-china-ios-app-store-coronavirus
92,Steven Seagal settles with SEC over 2018 cryptocurrency promotion,https://www.theverge.com/2020/2/27/21156024/steven-seagal-sec-cryptocurrency-settles-promotion
93,Congress postponed a vote to extend Patriot Act surveillance programs,https://www.theverge.com/2020/2/27/21155185/congress-house-judiciary-committee-postpone-fisa-patriot-act-zoe-lofgren-amendments
94,"Reddit CEO says TikTok is ‘fundamentally parasitic,’ cites privacy concerns",https://www.theverge.com/2020/2/27/21155845/reddit-ceo-steve-huffman-tiktok-privacy-concerns-spyware-fingerprinting-tracking-users
95,Coronavirus merch is somehow worse than I expected,https://www.theverge.com/2020/2/27/21155937/coronavirus-merch-shirts-amazon-etsy
96,Spotify is rolling out a new look for iOS that ditches word-based buttons,https://www.theverge.com/2020/2/27/21155933/spotify-new-look-mobile-ios-universal-icons
97,"Save on the OnePlus 7T, the 2019 iPad, and more",https://www.theverge.com/good-deals/2020/2/27/21147176/oneplus-7t-ipad-2019-bose-deals-sale-amazon-phone
98,Peloton settles lawsuits over songs being used in fitness videos without permission,https://www.theverge.com/2020/2/27/21155973/peloton-nmpa-settlement-music-publishers-fitness-videos-stolen-music
99,Samsung Galaxy S20 Ultra review: shutter bug,https://www.theverge.com/2020/2/27/21155012/samsung-galaxy-s20-ultra-review-5g-screen-camera-space-zoom-price
100,Timex is releasing a GPS smartwatch with 25 days of battery life,https://www.theverge.com/2020/2/27/21155862/timex-smartwatch-gps-fitness-tracker-battery-life
101,Uber tweaks its app to improve those pesky pickups,https://www.theverge.com/2020/2/27/21155866/uber-app-updates-pickup-notifcations-translation-text-message
102,From The Strategist: the 11 best crossbody travel bags,https://www.theverge.com/2020/2/27/21151522/best-cross-body-travel-bags-leather-nylon-fabric-recommendation-strategist
103,How to make and receive calls on your PC with the Your Phone app,https://www.theverge.com/2020/2/27/21122396/your-phone-app-android-pc-calls-how-to-make-answer-windows-10-microsoft
104,How to protect your privacy on Instagram,https://www.theverge.com/2020/2/27/21154221/instagram-privacy-how-to-stories-posts-settings-tags-ads-blocking
105,Robots aren’t taking our jobs — they’re becoming our bosses,https://www.theverge.com/2020/2/27/21155254/automation-robots-unemployment-jobs-vs-human-google-amazon
106,Ikea’s new meatless meatballs are coming to Europe in August,https://www.theverge.com/2020/2/27/21155742/ikea-meat-free-plant-ball-meatballs-europe-launch-august-2020
107,"Samsung S20 camera issues, the coronavirus gets serious for tech and the US, and more",https://www.theverge.com/tech/2020/2/27/21155445/samsung-s20-camera-issues-coronavirus-tech
108,Facebook once built a phone that could only be used by right-handed people,https://www.theverge.com/facebook/2020/2/27/21154578/facebook-phone-gfk-yves-behar-steven-levy-inside-story-highlights
109,Google Earth finally available in browsers other than Chrome,https://www.theverge.com/2020/2/27/21155707/google-earth-firefox-edge-opera-support-webassembly-code-update-web-release
110,Samsung pledges to improve Galaxy S20 camera after reviewers see issues,https://www.theverge.com/2020/2/26/21155255/samsung-galaxy-s20-camera-issues-update-promised
111,"Mike Pence, who enabled an HIV outbreak in Indiana, will lead US coronavirus response",https://www.theverge.com/2020/2/26/21155286/mike-pence-coronavirus-response-hiv
112,Etsy tells sellers it’s going to advertise their goods and take a big cut of the sale,https://www.theverge.com/2020/2/26/21155193/etsy-advertising-program-angers-sellers-cut-of-sales
113,Google is teaming up with Adidas and EA for a new Jacquard product,https://www.theverge.com/2020/2/26/21155100/google-ea-sports-adidas-teasing-collaboration-jacquard-fifa-mobile
114,Microsoft says Windows and Surface businesses will miss expectations due to coronavirus,https://www.theverge.com/2020/2/26/21155072/microsoft-adjusts-q3-guidance-surface-coronavirus
115,Sacramento Kings arena to use liquor-measuring gadget to control how much guests drink,https://www.theverge.com/2020/2/26/21154733/sacramento-kings-drinking-sports-nina-liquor-measuring-limit
116,How to use filters to improve your Instagram photos,https://www.theverge.com/2020/2/26/21154769/instagram-photo-filters-editing-camera-how-to
117,The Trump campaign is suing The New York Times over an op-ed about Russian election interference,https://www.theverge.com/2020/2/26/21154856/trump-campaign-files-libel-new-york-times-lawsuit-russia-election
118,Microsoft’s Xbox Series X will be able to resume games even after a reboot,https://www.theverge.com/2020/2/26/21154897/microsoft-xbox-series-x-resume-games-reboot-features-ray-tracing-audio
119,Destiny 2 will remove paid loot boxes in favor of a Fortnite-style battle pass,https://www.theverge.com/2020/2/26/21154809/destiny-2-paid-cosmetic-loot-boxes-fortnite-style-season-battle-pass-ending
120,Microsoft is adding a secret SkiFree-like surfing game into its Edge browser,https://www.theverge.com/2020/2/26/21154821/microsoft-edge-surf-game-easter-egg-secret-skifree-modes
121,Optimize your hustle,https://www.theverge.com/2020/2/26/21154514/hustle-culture-optimization-new-york-times-productivity-video-schlossberg
122,Everyone hates California’s self-driving car reports,https://www.theverge.com/2020/2/26/21142685/california-dmv-self-driving-car-disengagement-report-data
123,A visual history of the many Xbox dashboards,https://www.theverge.com/2020/2/26/21152674/xbox-design-history-360-one-series-x-console-dashboard
124,FCC filings reveal new Bang & Olufsen noise-canceling headphones might be on the way,https://www.theverge.com/2020/2/26/21154546/fcc-filings-reveal-new-bang-olufsen-headphones-beoplay-h95-design
125,"Music revenue saw big growth last year, thanks to a jump in paid streaming subscribers",https://www.theverge.com/2020/2/26/21154504/riaa-report-paid-subscriptions-93-percent-streaming-revenue-growth-2019
126,Self-driving shuttle company ordered to stop carrying passengers after injury,https://www.theverge.com/2020/2/26/21154532/easymile-columbus-ohio-nhtsa-suspension-injury
127,FBI arrests neo-Nazi group Atomwaffen’s leader on swatting charges,https://www.theverge.com/2020/2/26/21154536/fbi-atomwaffen-division-neo-nazi-graveyard-irc-arrest-swatting
128,Google plans to invest $10 billion in US offices and data centers in 2020,https://www.theverge.com/2020/2/26/21154358/google-10-billion-offices-data-centers-investment-sundar-pichai
129,Mercedes-Benz’s subscription service now includes high-performance AMG models,https://www.theverge.com/2020/2/26/21154558/mercedes-benz-subscription-service-amg-model-price
130,"Google Translate supports new languages for the first time in four years, including Uyghur",https://www.theverge.com/2020/2/26/21154417/google-translate-new-languages-support-odia-tatar-turkmen-uyghur-kinyarwanda
131,Pete Buttigieg is winning Gmail’s spam primary,https://www.theverge.com/2020/2/26/21154193/pete-buttigieg-gmail-primary-dems-2020-candidates
132,Amazon’s Eero routers get updated with Apple’s HomeKit support,https://www.theverge.com/circuitbreaker/2020/2/26/21154531/amazon-eero-routers-apple-homekit-support-internet-connection-security
133,Apple’s latest MacBook Air is more affordable than ever today,https://www.theverge.com/good-deals/2020/2/26/21154343/apple-macbook-air-2019-256gb-deal-sale-discount-amazon
134,Pope Francis asks followers to give up trolling for Lent,https://www.theverge.com/2020/2/26/21154340/pope-francis-ash-wednesday-lent-speech-internet-insults-phones
135,GOG will refund your games even after you’ve started playing them,https://www.theverge.com/2020/2/26/21154402/good-old-games-refund-policy-30-days-download-played-blanket-policy
136,The Mate X electric folding bike is $300 off for Verge readers,https://www.theverge.com/good-deals/2020/2/26/21154285/mate-x-electric-folding-bike-sale-discount-deal
137,System that limits e-bike speeds will be tested on Dutch roads,https://www.theverge.com/2020/2/26/21154094/ebike-dutch-speed-limit-system-test-green-light-schiphol-s-pedelec-isa
138,"USDA is holding back on rural broadband funding, senators say",https://www.theverge.com/2020/2/26/21153910/rural-broadband-usda-reconnect-grants-wyden-fcc-digital-opportunity-fund
139,Oprah is now turning old TV episodes into podcasts,https://www.theverge.com/2020/2/26/21154270/oprah-show-podcast-release-tv-episodes-interviews-guests
140,Leaked video reveals new Surface Duo ‘peek’ feature,https://www.theverge.com/2020/2/26/21154310/microsoft-surface-duo-peek-feature-calls-notifications-android-video
141,Tempo is a smart home gym that uses computer vision to track your form in real time,https://www.theverge.com/2020/2/26/21154185/tempo-smart-home-gym-kinect-computer-vision-ai-form-correction
142,LG’s new V60 ThinQ 5G shows steady evolution for a company in need of big change,https://www.theverge.com/2020/2/26/21144177/lg-v60-thinq-5g-announced-camera-price-specs-dual-screen
143,"Apple won’t let bad guys use iPhones in movies, says Knives Out director",https://www.theverge.com/tldr/2020/2/26/21154151/apple-bad-guys-movies-iphones-product-placement
144,Firefox is showing the way back to a world that’s private by default,https://www.theverge.com/tech/2020/2/26/21153525/firefox-dns-encryption-amazon-go-browsing-shopping-privacy
