145,Brave browser now automatically points to Wayback Machine on 404,https://www.theverge.com/2020/2/26/21154096/brave-browser-wayback-machine-404-internet-archive-lost-pages
146,‘Facebook: The Inside Story’ author Steven Levy on how the company compares to Apple and Google,https://www.theverge.com/interface/2020/2/26/21152872/facebook-inside-story-steven-levy-q-a-mark-zuckerberg-sheryl-sandberg
147,Facebook confirms ban on misleading coronavirus ads,https://www.theverge.com/2020/2/26/21154069/facebook-coronavirus-advertising-ban-misinformation-sense-of-urgency
148,Fujifilm X-T4 announced with in-body image stabilization and flip-out screen,https://www.theverge.com/2020/2/26/21151718/fujifilm-xt4-announced-specs-pricing-ibis-stabilization-vlogging
149,Toyota steers $400 million to self-driving startup Pony.ai,https://www.theverge.com/2020/2/25/21152817/toyota-pony-ai-self-driving-car-investment-valuation-china-silicon-valley
150,Slickwraps apologizes to customers after comically bad data breach,https://www.theverge.com/2020/2/25/21153434/slickwraps-apologizes-customers-bad-data-breach
151,Music Fingers is the newest weird beat-making gadget,https://www.theverge.com/2020/2/25/21143793/music-fingers-beat-making-gadget-kickstarter
152,Fraidycat is a fantastic new app for keeping tabs on your favorite internet gems,https://www.theverge.com/tldr/2020/2/25/21153460/fraidycat-app-extension-internet-reader-rss-news-blogs-youtube
153,The Smithsonian has released more than 2.8 million images you can use for free,https://www.theverge.com/2020/2/25/21153208/smithsonian-institution-museums-free-images-libraries-dc
154,"Steam just added new search features, including a price filter",https://www.theverge.com/2020/2/25/21153257/steam-labs-new-search-features-tag-filter-price-vr
155,"Tesla Autopilot, distracted driving to blame in deadly 2018 crash",https://www.theverge.com/2020/2/25/21153320/tesla-autopilot-walter-huang-death-ntsb-probable-cause
156,This AirPod-holding Apple Watch band is either brilliant or incredibly dumb,https://www.theverge.com/2020/2/25/21152971/airpod-apple-watch-band-holder-airband-kickstarter
157,Amazon warns sellers against price gouging face masks amid coronavirus concerns,https://www.theverge.com/2020/2/25/21153158/amazon-coronavirus-face-masks-price-gouging-increase-third-party-sellers
158,How to make a seamless Instagram panorama,https://www.theverge.com/2020/2/25/21152029/instagram-panorama-how-to-make-feed-photos-dimensions
159,Comcast just acquired a streaming service you’ve probably never heard of from the owner of Myspace,https://www.theverge.com/2020/2/25/21153029/comcast-xumo-acquisition-streaming-wars-tv-film-viant-myspace
160,The internet of tea,https://www.theverge.com/2020/2/25/21152743/yorkshire-tea-rishi-sunak-boris-johnson-brexit-twitter-social-media
161,"Tesla ignored safety board’s Autopilot recommendations, chairman says",https://www.theverge.com/2020/2/25/21152984/tesla-autopilot-safety-recommendations-ignored-ntsb-crash-hearing
162,"Instacart’s shoppers probably qualify as employees, judge rules",https://www.theverge.com/2020/2/25/21152831/instacart-california-shoppers-misclassified-ruling-ab5-gig-workers
163,New Juul patent application hints at AI-powered vape to help users quit nicotine,https://www.theverge.com/2020/2/25/21152436/juul-patent-e-cigarettes-vaping-ai-smartphone-quit-nicotine
164,How to deactivate your Twitter account,https://www.theverge.com/2020/2/25/21152626/twitter-delete-app-how-to-deactivate-browser-alternatives
165,Qualcomm reveals a headset design for its latest VR chips,https://www.theverge.com/2020/2/25/21147912/qualcomm-snapdragon-xr2-vr-ar-xr-platform-reference-design-announcement
166,Space Channel 5 makes a funky return in VR,https://www.theverge.com/2020/2/25/21152374/space-channel-5-vr-review-psvr-ps4-release-date
167,The Solid State Watch is the simplest digital watch ever,https://www.theverge.com/circuitbreaker/2020/2/25/21152419/cwt-solid-state-watch-time-digital-casio-f91w-1-kickstarter-battery
168,Moment made a retro video app for iPhones,https://www.theverge.com/2020/2/25/21147761/moment-rtro-video-app-retro-filters-stories-ios-iphone
169,How to live stream tonight’s 2020 Democratic debate,https://www.theverge.com/2020/2/25/21152526/democratic-debate-watch-live-stream-how-to-start-time-candidates-super-tuesday
170,Argo AI’s CEO explains why its fleet of self-driving taxis won’t be all-electric (at first),https://www.theverge.com/2020/2/25/21147747/argo-ai-ceo-bryan-salesky-self-dring-cars-ev-vergecast-interview
171,"Save on gaming mice, laptops, G-Sync monitors, and more",https://www.theverge.com/good-deals/2020/2/25/21152546/logitech-g502-lightspeed-asus-gsync-compatible-monitor-ring-doorbell-pro-sale-deal-amazon
172,How to unroll a Twitter thread,https://www.theverge.com/2020/2/25/21152579/twitter-thread-easier-full-text-reading-unroll-how-to
173,Nest cameras were down for 17 hours because of failed server update,https://www.theverge.com/2020/2/25/21152534/nest-cameras-outage-google-security
174,Uber and Lyft generate 70 percent more pollution than trips they displace: study,https://www.theverge.com/2020/2/25/21152512/uber-lyft-climate-change-emissions-pollution-ucs-study
175,Samsung’s Galaxy S20 lineup is first to get USB certification for new fast charging tech,https://www.theverge.com/2020/2/25/21152462/samsung-galaxy-s20-fast-charger-certified-usb-implimenters-forum
176,The makers of Jif peanut butter team up with Giphy to try to settle the GIF/Jif debate once and for all,https://www.theverge.com/tldr/2020/2/25/21147389/jif-peanut-butter-giphy-settle-gif-pronunciation-debate
177,"Yelp beefs up its waitlist feature, including support for large parties",https://www.theverge.com/2020/2/25/21151595/yelp-waitlist-feature-support-notification-update
178,Bird Pay tries to appease local businesses plagued by scooters,https://www.theverge.com/2020/2/25/21152362/bird-pay-cashless-payments-scooter-app
179,The best Apple rumor right now is Gmail,https://www.theverge.com/2020/2/25/21151530/apple-rumors-spring-hardware-event-arm-mac-default-apps-iphone
180,Firefox turns controversial new encryption on by default in the US,https://www.theverge.com/2020/2/25/21152335/mozilla-firefox-dns-over-https-web-privacy-security-encryption
181,Polestar teases an all-electric concept sedan running Android Automotive,https://www.theverge.com/2020/2/25/21151592/polestar-precept-concept-electric-car-2020-geneva-motor-show
182,The Bloomberg campaign’s social media stunts keep backfiring,https://www.theverge.com/interface/2020/2/25/21150988/bloomberg-social-network-stunts-backfiring-twitter-video-paid-influencers
183,Microsoft’s new Xbox One dashboard now available with updated home screen,https://www.theverge.com/2020/2/25/21152327/microsoft-xbox-one-dashboard-update-design-home-screen-features
184,The HyperBoom is Ultimate Ears’ first speaker suited for big parties,https://www.theverge.com/2020/2/25/21142365/ultimate-ears-ue-hyperboom-party-bluetooth-speaker-price-features
185,Amazon is expanding its cashierless Go model into a full-blown grocery store,https://www.theverge.com/2020/2/25/21151021/amazon-go-grocery-store-expansion-open-seattle-cashier-less
186,Oppo’s Find X2 flagship phone will be announced next week,https://www.theverge.com/2020/2/25/21152280/oppo-find-x2-announcement-date-screen-specs
187,China reportedly using WeChat and Twitter to find and silence people sharing coronavirus information,https://www.theverge.com/2020/2/24/21151404/china-wechat-twitter-coronavirus-critics-protest-information-share
188,Apple’s new Mac Pro and Pro Display technology overviews show off just how ‘pro’ they are,https://www.theverge.com/circuitbreaker/2020/2/24/21151597/apple-new-mac-pro-display-xdr-technology-overview-white-papers-details-new
189,Uber will start putting ads on top of some of its vehicles,https://www.theverge.com/2020/2/24/21151534/uber-ads-advertising-roof-car-adomni
190,Apple investor Warren Buffett finally upgrades from a flip phone to an iPhone,https://www.theverge.com/2020/2/24/21151414/warren-buffet-apple-iphone-flip-phone-upgrade-change-gone
191,"TurboTax maker is spending $7.1 billion to buy Credit Karma, a free tax service competitor",https://www.theverge.com/2020/2/24/21150609/turbo-tax-credit-karma-intuit-purchase-competitor-credit-checks
192,Netflix rolls out Top 10 feature to help show what people are actually watching,https://www.theverge.com/2020/2/24/21151327/netflix-top-10-list-homepage-subscribers-originals-licensed-movies-tv-shows
193,Huawei’s P40 lineup will launch March 26th in Paris,https://www.theverge.com/2020/2/24/21151121/huawei-p40-phone-google-launch-date-specs-colors-china
194,Honor’s first 5G phone will launch globally without Google’s apps or services,https://www.theverge.com/2020/2/24/21151055/honor-9x-pro-release-date-price-camera-google-apps-service-mwc
195,Purdue online students can now graduate in VR,https://www.theverge.com/2020/2/24/21151026/purdue-university-global-online-graduation-vr-google-cardboard-commencementt
196,Apple’s first ARM-based Macs may start showing up as early as next year,https://www.theverge.com/2020/2/24/21151066/apple-mac-arm-chips-custom-intel-processors
197,This tweet reminded me that driverless cars can still blow our minds,https://www.theverge.com/2020/2/24/21150829/waymo-driverless-cars-tweet-excitement-technology
198,"President and COO of AT&T, a huge tech company, worries about tech companies’ power",https://www.theverge.com/2020/2/24/21150638/john-stankey-facebook-att-monopoly-media-power
199,Go read this survey about tech workers and H-1B visas under the Trump administration,https://www.theverge.com/2020/2/24/21150943/onezero-medium-h-1b-visa-trump-administration-immigration-policy
200,This hack will let you play Google Stadia on a phone without a controller,https://www.theverge.com/2020/2/24/21150914/google-stadia-touchstadia-android-phone-hack
201,Signal becomes European Commission’s messaging app of choice in security clampdown,https://www.theverge.com/2020/2/24/21150918/european-commission-signal-encrypted-messaging
202,"The Wyze Band is part fitness tracker, part Alexa smart home controller",https://www.theverge.com/2020/2/24/21150549/fitness-tracker-wyze-band-alexa
203,The Xbox One will soon get the ability to eject discs with a controller,https://www.theverge.com/2020/2/24/21150704/xbox-one-eject-disc-x-s-feature-controller
204,"How to design a tour good enough for Katy Perry, Taylor Swift, or J.Lo",https://www.theverge.com/2020/2/24/21074821/silent-house-productions-tour-design-katy-perry-taylor-swift-j-lo-grammys
205,TSA bans employees from using TikTok,https://www.theverge.com/2020/2/24/21150667/tsa-tiktok-employee-ban-bytedance-chuck-schumer-homeland-security
206,Save on Blu-ray versions of the Twin Peaks show and Fire Walk with Me prequel film,https://www.theverge.com/good-deals/2020/2/24/21150575/twin-peaks-day-amazon-sale-tv-show-movie-third-season-bluray-dvds
207,"Samsung Galaxy Buds Plus review: better sound, even better stamina",https://www.theverge.com/2020/2/24/21147654/samsung-galaxy-buds-plus-review-wireless-earbuds-sound-quality-battery-life
208,Microsoft confirms Xbox Series X will support ‘four generations of gaming’,https://www.theverge.com/2020/2/24/21150594/microsoft-xbox-series-x-backwards-compatibility-support-smart-delivery
209,"Microsoft reveals more Xbox Series X specs, confirms 12 teraflops GPU",https://www.theverge.com/2020/2/24/21150578/microsoft-xbox-series-x-specs-performance-12-teraflops-gpu-details-features
210,Lenovo adds nine new laptops to its ThinkPad lineup,https://www.theverge.com/2020/2/24/21147697/lenovo-thinkpad-x-series-t-series-lineup-announce-pricing-release-date
211,"YouTube briefly terminated a popular live stream channel, creating one of the longest videos ever",https://www.theverge.com/2020/2/24/21150488/chilledcow-lofi-hiphop-livestream-youtube-termiantion-vod-anime-study-girl
212,Huawei’s new MateBook X Pro comes in green color option and Intel’s latest chips,https://www.theverge.com/2020/2/24/21150373/huawei-matebook-x-pro-2020-intel-specs-features-announcement
213,Huawei announces the Mate XS foldable with a more durable display and faster processor,https://www.theverge.com/2020/2/24/21145519/huawei-mate-xs-foldable-phone-news-features-quad-layer-screen-hinge-kirin-990-5g
214,Huawei made a 5G iPad Pro clone with wireless charging,https://www.theverge.com/2020/2/24/21145754/huawei-matepad-pro-5g-tablet-wireless-charging-specs-news-features
215,Chess champion Garry Kasparov who was replaced by AI says most US jobs are next,https://www.theverge.com/2020/2/24/21150423/garry-kasparov-ai-jobs-ethics-evil-interview
216,Disney Plus announces preorder discounts for Europe,https://www.theverge.com/2020/2/24/21150413/disney-plus-european-pre-launch-discounts-annual-pricing
217,"HyperX’s Cloud Flight S has Qi charging, but at the expense of some useful features",https://www.theverge.com/2020/2/24/21145868/hyperx-cloud-flight-s-wireless-gaming-headset-qi-review-specs-features-price
218,Apple’s over-ear headphones could be launching soon,https://www.theverge.com/2020/2/24/21150385/apple-over-ear-headphones-price-release-date-target-leak
219,Vivo’s Apex 2020 concept phone is coming on Friday,https://www.theverge.com/2020/2/24/21150389/vivo-apex-2020-concept-phone-announcement-date
220,Realme’s X50 Pro has a Snapdragon 865 and 5G for $600,https://www.theverge.com/2020/2/24/21150238/realme-x50-pro-specs-price-release-announcement
221,Sony’s new Xperia 1 II adds 5G to its lineup of tall phones,https://www.theverge.com/2020/2/24/21147066/sony-xperia-phone-1-ii-specs-price-features-5g-triple-camera-headphone-jack-wireless-changing
222,From The Strategist: the 13 best travel mugs,https://www.theverge.com/2020/2/23/21146096/best-travel-mugs-coffee-strategist-glass-ceramic-steel
223,Donald Trump ads will take over YouTube for Election Day,https://www.theverge.com/2020/2/22/21148550/donald-trump-campaign-youtube-campaign-ad-buy-2020-election
224,Twitter suspends 70 pro-Michael Bloomberg accounts for ‘platform manipulation’,https://www.theverge.com/2020/2/22/21148516/twitter-suspends-mike-bloomberg-facebook-google-platform-manipulation
225,Coronavirus email hoax led to violent protests in Ukraine,https://www.theverge.com/2020/2/21/21147969/coronavirus-misinformation-protests-ukraine-evacuees
226,Google addresses Huawei ban and warns customers not to sideload apps like Gmail and YouTube,https://www.theverge.com/2020/2/21/21147919/google-addresses-huawei-services-ban-android-trump-sideload-apps
227,Twitter’s messy verification process is making candidates wait,https://www.theverge.com/2020/2/21/21147563/twitter-verified-candidates-super-tuesday-elections-2020
228,NBCUniversal reportedly close to acquiring Walmart’s Vudu video service,https://www.theverge.com/2020/2/21/21147837/nbcuniversal-vudu-acquisition-rumor-walmart-peacock-video-streaming
229,"Russia is interfering in Democratic primary to help Sanders, officials say",https://www.theverge.com/2020/2/21/21147801/bernie-sanders-russia-presidential-campaign-trump-election-interference
230,Bethesda follows Activision in pulling games from Nvidia’s GeForce Now,https://www.theverge.com/2020/2/21/21147638/nvidia-geforce-now-bethesda-pulling-games-activision-blizzard-cloud-gaming
231,How to use the Tor Browser’s tools to protect your privacy,https://www.theverge.com/2020/2/21/21138403/tor-privacy-tools-private-network-browser-settings-security
232,Company buying .org offers to sign a contract banning price hikes,https://www.theverge.com/2020/2/21/21147448/ethos-capital-org-legally-binding-agreement-tld-pir-isoc-icann
233,Twitter bot @real_human_vc is coming for your thought leaders,https://www.theverge.com/2020/2/21/21147096/twitter-bot-thought-leaders-ai-venture-capital-real-human-language
234,"Google Forms could secure Nevada’s caucuses, or throw reporting into chaos",https://www.theverge.com/2020/2/21/21147450/google-forms-nevada-caucus-iowa-app-shadow-acronym-recording-reporting-tool
235,Arlo Pro 3 home security cameras now support Apple’s HomeKit,https://www.theverge.com/2020/2/21/21147233/arlo-pro-3-home-security-cameras-support-apple-homekit
236,All the ways China’s coronavirus outbreak is affecting tech,https://www.theverge.com/2020/2/7/21128307/coronavirus-outbreak-tech-industry-production-supply-chain-delay-impact
237,Google’s Stadia adds four SteamWorld games to its lineup,https://www.theverge.com/2020/2/21/21147010/google-stadia-games-steamworld-dig-2-heist-hand-of-gilgamech-lineup
238,"Google is indexing WhatsApp group chat links, making even private groups discoverable",https://www.theverge.com/2020/2/21/21147073/whatsapp-google-group-chat-join-indexing-links-search-privacy-facebook
239,iOS 14 is a chance for Apple to lower its walls,https://www.theverge.com/2020/2/21/21146804/apple-ios-14-features-default-apps-settings-restrictions-apis-rumors
240,"Vergecast: Galaxy Z Flip review, Android 11 preview, and a ‘house of brands’",https://www.theverge.com/2020/2/21/21146982/podcast-galaxy-z-flip-review-vergecast-android-11-preview-streaming
241,How to use Instagram to share with other social networks,https://www.theverge.com/2020/2/21/21146101/instagram-share-posts-how-to-photos-facebook-twitter-app
242,iHeartRadio is now turning podcasts into books,https://www.theverge.com/2020/2/21/21146958/podcast-books-iheartmedia-stuff-you-should-know-flatiron-release
243,Samsung Galaxy Z Flip review: temper your expectations,https://www.theverge.com/2020/2/21/21146465/samsung-galaxy-z-flip-review-folding-glass-flip-phone-screen-camera-price
244,"Save on Samsung Galaxy S20 preorder bundles, Xbox One X consoles, and more",https://www.theverge.com/good-deals/2020/2/21/21146956/samsung-galaxy-s20-preorder-bundles-xbox-one-x-consoles-s10-deal-sale
245,Apple awarded temporary restraining order against Tim Cook’s stalker,https://www.theverge.com/2020/2/21/21147011/apple-ceo-tim-cook-stalker-aggressive-executives-palo-alto-police-restraining-order
246,Hot Wheels announces a remote-controlled Tesla Cybertruck,https://www.theverge.com/2020/2/21/21147004/hot-wheels-tesla-cybertruck-rc-car-remote-controlled-toy
247,TiVo’s skip button changed how we watch TV forever,https://www.theverge.com/2020/2/21/21136537/tivo-skip-button-tv-dvr-fast-forward
248,This AirPods case case looks like a Game Boy,https://www.theverge.com/2020/2/21/21146638/game-boy-airpods-case-elago-available-price
249,BTS fans didn’t break TikTok; a broken link did,https://www.theverge.com/2020/2/21/21146848/bts-tiktok-on-single-challenge-broken-app-crash-link
250,Google is cracking down on Android apps that track your location in the background,https://www.theverge.com/2020/2/21/21146834/google-play-store-background-location-tracking-review-process-android-11
251,Bloomberg’s debate performance shows that Facebook ads will only get you so far,https://www.theverge.com/interface/2020/2/21/21145639/bloomberg-debate-performance-facebook-advertising
252,LG V60 ThinQ shown off in leaked press render,https://www.theverge.com/2020/2/21/21146800/lg-v60-thinq-leak-render-teardrop-notch-google-assistant-button-gold-frame
253,Tesla’s Berlin Gigafactory is back on track following environmental challenge,https://www.theverge.com/2020/2/21/21146770/tesla-berlin-gigafactory-tree-felling-work-continues-environmental-concerns
254,Here’s where you can preorder the Samsung Galaxy S20,https://www.theverge.com/2020/2/11/21126784/samsung-galaxy-s20-plus-ultra-preorder-how-to-price-verizon-tmobile-sprint
255,Quibi shares some clues about how its app might work,https://www.theverge.com/2020/2/20/21146270/quibi-app-screenshots-ios-android-play-store
256,"Bloomberg debate video would violate Twitter’s deepfake policy, but not Facebook’s",https://www.theverge.com/2020/2/20/21146227/facebook-twitter-bloomberg-debate-video-manipulated-deepfake
257,Twitch is making it easier to understand League of Legends matches,https://www.theverge.com/2020/2/20/21146174/twitch-league-of-legends-live-tracker-extension
258,"Russia is meddling in 2020 campaign to help Trump, intelligence officials say",https://www.theverge.com/2020/2/20/21146191/russia-election-meddling-2020-hack-trump-intelligence
259,Twitter’s upcoming manipulated media policy may include labels for ‘harmfully misleading’ tweets,https://www.theverge.com/2020/2/20/21145827/twitter-test-misinformation-politicians-tweets
260,This is how Microsoft designed its new colorful Windows 10 icons,https://www.theverge.com/2020/2/20/21146028/microsoft-windows-10-new-icons-colorful-design-changes-updates-fluent-design-system
261,YouTube receives FTC complaint over videos of journalist’s death,https://www.theverge.com/2020/2/20/21145959/google-youtube-journalist-death-video-ftc-complaint-parker
262,This disturbingly realistic deepfake puts Jeff Bezos and Elon Musk in a Star Trek episode,https://www.theverge.com/tldr/2020/2/20/21145826/deepfake-jeff-bezos-elon-musk-alien-star-trek-the-cage-amazon-tesla
263,Eli Roth is directing a film adaptation of Borderlands,https://www.theverge.com/2020/2/20/21145855/borderlands-film-eli-roth-gearbox-live-action-adaptation-direct
264,Facebook will now pay you for your voice recordings,https://www.theverge.com/2020/2/20/21145584/facebook-pay-record-voice-speech-recognition-viewpoints-proununciations-app
265,Google bans hundreds of Android apps from the Play Store for obnoxious ads,https://www.theverge.com/2020/2/20/21145595/google-app-ban-ads-play-store-android-user-experience
266,How The Mandalorian teamed up with Fortnite creator Epic Games to create its digital sets,https://www.theverge.com/2020/2/20/21145671/mandalorian-sets-stagecraft-epic-games-ilm-fortnite-baby-yoda-digital
267,Peloton for iOS now supports Chromecast,https://www.theverge.com/2020/2/20/21145727/peloton-ios-app-chromecast-support-update
268,"Forget Grimes’ new digital self, I want her gold-plated glasses",https://www.theverge.com/2020/2/20/21145624/grimes-warnymph-digital-avatar-miss-anthropocene
269,Vizio is adding Disney Plus to its smart TV platform,https://www.theverge.com/2020/2/20/21135161/vizio-disney-plus-parental-controls-smart-tv-smartcast
270,Google sued by New Mexico attorney general for collecting student data through Chromebooks,https://www.theverge.com/2020/2/20/21145698/google-student-privacy-lawsuit-education-schools-chromebooks-new-mexico-balderas
271,HBO and HBO Max are headed to YouTube TV,https://www.theverge.com/2020/2/20/21145651/youtube-tv-hbo-streaming-max-cinemax-carriage-deal
272,Google AI tool will no longer use gendered labels like ‘woman’ or ‘man’ in photos of people,https://www.theverge.com/2020/2/20/21145356/google-ai-images-gender-bias-labels-people
273,Cyberpunk 2077 is coming to Nvidia’s GeForce Now on launch day,https://www.theverge.com/2020/2/20/21145328/cyberpunk-2077-nvidia-geforce-now-launch-day
274,"Rivian loses its first CTO, a veteran Apple exec who helped create the iPhone",https://www.theverge.com/2020/2/20/21143374/rivian-cto-mike-bell-left-apple-intel
275,Disney’s avalanche of Baby Yoda merch includes an adorable mini Bluetooth speaker,https://www.theverge.com/2020/2/20/21145574/star-wars-baby-yoda-bluetooth-speaker-disney-mandalorian
276,"Dr Disrespect is writing a memoir, which will be published in 2021",https://www.theverge.com/2020/2/20/21145434/dr-disrespect-memoir-violence-speed-momentum-publish-date-twitch
277,Verizon says it’s fully committed to Google’s phones this year after rumor of a split,https://www.theverge.com/2020/2/20/21145538/google-verizon-pixel-phone-support-2020
278,How to use Opera’s tools to protect your privacy while browsing,https://www.theverge.com/2020/2/20/21136772/opera-privacy-tools-private-network-browser-settings-security
279,Flywheel owners found out that their bikes were bricked through Peloton,https://www.theverge.com/2020/2/20/21145349/flywheel-bike-shut-down-email-user-reactions-peloton-trade-in
280,Twitter now makes it easier to add new tweets to old threads,https://www.theverge.com/2020/2/20/21145288/twitter-threads-update-add-new-tweets-old-ios-app
281,"Gaming headsets, mice, and more are discounted at Best Buy",https://www.theverge.com/good-deals/2020/2/20/21142663/gaming-deals-headsets-wireless-mice-fortnite-razer-best-buy-epic
282,How to delete Uber and Lyft from your life,https://www.theverge.com/2020/2/20/21145313/uber-lyft-delete-apps-how-to-ethical-transportation-ride-share
283,T-Mobile’s OnePlus 7T Pro 5G McLaren is getting faster with a software update,https://www.theverge.com/2020/2/20/21145292/t-mobile-oneplus-7t-pro-5g-mclaren-faster-lte-network-bandwidth-software-update
284,HTC is prototyping an AR headset that looks like sunglasses,https://www.theverge.com/2020/2/20/21145260/htc-project-proton-vr-ar-xr-headset-prototype-cosmos-vive-5g
285,Microsoft is bringing its antivirus software to iOS and Android,https://www.theverge.com/2020/2/20/21145388/microsoft-antivirus-ios-android-apps-software-defender-security-malware
286,From The Strategist: the 14 best laptop cases and bags,https://www.theverge.com/2020/2/20/21137810/best-laptop-cases-sleeves-messenger-bags-backpacks-strategist
287,3Doodler’s newest toy lets kids make 3D objects with molds,https://www.theverge.com/2020/2/20/21135202/3doodler-3d-printer-build-play-toy-fair-2020
288,How to find great Instagram accounts to follow,https://www.theverge.com/2020/2/20/21142704/instagram-accounts-follow-facebook-contacts-how-to
289,HTC unveils new Vive Cosmos VR lineup with swappable faceplates,https://www.theverge.com/2020/2/20/21145156/htc-vive-cosmos-series-announced-elite-play-xr-faceplates
